name;money;post;class;level;org
ADELARDO ADELINO DANTAS DE MEDEIROS;17.833,66;PROFESSOR DO MAGISTERIO SUPERIOR;7;704;PRO-REITORIA DE GRADUACAO
ABMAEL BEZERRA DE OLIVEIRA;10.388,52;PROFESSOR DO MAGISTERIO SUPERIOR;6;604;DEPARTAMENTO DE ENGENHARIA ELETRICA
ADAILTON GARCIA DA SILVA;7.464,42;TECNICO EM AGROPECUARIA;D;;ESCOLA AGRICOLA DE JUNDIAI - UAECA
ADA CRISTINA SCUDELARI;19.995,43;PROFESSOR DO MAGISTERIO SUPERIOR;8;801;DEPARTAMENTO DE ENGENHARIA CIVIL
ADA ISA CUSTODIO DE MESQUITA;;;;;
ADALBERTO ATSUSHI HAMAGUCHI PORTO;;;;;
ACYNELLY DAFNE DA SILVA NUNES;;;;;
ADAMO PERRUCCI;10.557,63;PROFESSOR MAGISTERIO SUPERIOR -VISITANTE;4;601;DEPT DE DIREITO PROCESSUAL PROPEDEUTICA
ACACIA JESSICA MAIA DE MOURA;6.580,61;ASSISTENTE SOCIAL;E;;ESCOLA AGRICOLA DE JUNDIAI - UAECA
ADAILDE TEIXEIRA DE ALMEIDA;9.820,24;AUXILIAR DE ENFERMAGEM;C;;MATERNIDADE ESCOLA JANUARIO CICCO
ADEILZE MAIA DE MORAIS MEDEIROS;3.293,48;AUXILIAR DE LABORATORIO;B;;DEPARTAMENTO DE FARMACIA
ADALBERTO FABRICIO DA SILVA;8.580,81;MEDICO-AREA;E;;MATERNIDADE ESCOLA JANUARIO CICCO
ACILENE MARIA BORGES GOMES OLIVEIRA;5.795,02;AUX EM ADMINISTRACAO;C;;GABINETE DO REITOR
ADDISON RIBEIRO DE ALMEIDA;3.303,39;TECNICO DE LABORATORIO AREA;D;;DEPARTAMENTO DE FARMACIA
ADAM RAFAEL GONCALVES CAVALCANTE;2.905,70;ASSISTENTE EM ADMINISTRACAO;D;;DEPARTAMENTO DE ESTATISTICA
ADAUTO LUIZ DE PAIVA FERNANDES;9.008,55;;;;
ACACIO MEDEIROS NOGUEIRA;15.897,63;TECNOLOGO-FORMACAO;E;;PRO-REITORIA DE ASSUNTOS ESTUDANTIS
ADAUTO SABINO BEZERRA;8.440,26;VIGILANTE;D;;DIVISAO DE SEGURANCA PATRIMONIAL
ABNER CARLOS COSTA DE MELO;2.796,64;TECNICO EM ELETROTECNICA;D;;DEPTO DE FISICA TEORICA E EXPERIMENTAL
ADALBERTO ALMEIDA DE ARAUJO JUNIOR;2.796,64;TECNICO EM ARTES GRAFICAS;D;;EDITORA UNIVERSITARIA
ABDO FARRET NETO;4.434,51;PROFESSOR DO MAGISTERIO SUPERIOR;6;601;DEPARTAMENTO DE MEDICINA INTEGRADA
ADEILDE LIMA DA SILVA;4.538,01;AUX EM ADMINISTRACAO;C;;ADMINISTRACAO DO CCS
ABRAHAO SANDERSON NUNES FERNANDES DA SILVA;11.085,51;PROFESSOR DO MAGISTERIO SUPERIOR;6;601;DEPARTAMENTO DE HISTORIA-CERES
ADALGIZA CRISTINA GOMES DE OLIVEIRA;;;;;
ADA LIMA FERREIRA DE SOUSA;10.239,82;PROFESSOR DO MAGISTERIO SUPERIOR;5;501;ESCOLA DE CIENCIAS E TECNOLOGIA - UAECT
ADAILDO GOMES D ASSUNCAO;41.032,37;PROFESSOR DO MAGISTERIO SUPERIOR;8;801;DEPARTAMENTO DE PESSOAL/INATIVOS CIVIS
ADAUTO CHIAMENTI;19.813,54;PROFESSOR ENS BASICO TECN TECNOLOGICO;D;501;ESCOLA AGRICOLA DE JUNDIAI - UAECA
ADALA NAYANA DE SOUSA MATA;4.209,12;PROFESSOR DO MAGISTERIO SUPERIOR;4;501;ESCOLA MULTICAMPI DE CIENCIAS MEDICAS
ADELAIDE MARIA MORAIS AVELINO;13.982,13;ASSISTENTE SOCIAL;E;;DIRETORIA DE ATENCAO A SAUDE DO SERVIDOR
ADELE GUIMARAES UBARANA SANTOS;11.308,31;PROFESSOR ENS BASICO TECN TECNOLOGICO;D;302;COLEGIO DE APLICACAO - NEI
ADILSON JOSE DE OLIVEIRA;12.829,38;PROFESSOR DO MAGISTERIO SUPERIOR;6;603;DEPARTAMENTO DE ENGENHARIA MECANICA
ADELSON APRIGIO FILGUEIRA;4.679,12;ASSISTENTE EM ADMINISTRACAO;D;;PRO-REITORIA DE GRADUACAO
ADRIANA DA FONTE PORTO CARREIRO;16.555,95;PROFESSOR DO MAGISTERIO SUPERIOR;7;703;DEPARTAMENTO DE ODONTOLOGIA
ADRIAN ANTONIO GARDA;13.595,93;PROFESSOR DO MAGISTERIO SUPERIOR;7;701;ADMINISTRACAO DO CB
ADIR LUIZ FERREIRA;19.917,10;PROFESSOR DO MAGISTERIO SUPERIOR;8;801;DEPTO DE FUND E POLITICAS DA EDUCACAO
ADERSON JAMIER SANTOS REIS;-1000;PROFESSOR MAGISTERIO SUPERIOR-SUBSTITUTO;4;601;DEPTO DE ENG DE COMPUTACAO E AUTOMACAO
ADEMIR OLIVEIRA DA SILVA;19.321,56;PROFESSOR DO MAGISTERIO SUPERIOR;8;801;INSTITUTO DE QUIMICA
ADRIANA CRISTINA AIRES DE MELO;11.549,04;ENFERMEIRO-AREA;E;;MATERNIDADE ESCOLA JANUARIO CICCO
ADENILDA JANE ROSA DA SILVA;6.052,23;TECNICO EM ENFERMAGEM;D;;HOSPITAL UNIVERSITARIO ONOFRE LOPES
ADILIANE SILVA DE PAULA;3.851,66;TRADUTOR INTERPRETE DE LINGUAGEM SINAIS;D;;DEPARTAMENTO DE LETRAS
ADRIANA ALVES DA SILVA ALVES DIAS;6.837,25;BIBLIOTECARIO-DOCUMENTALISTA;E;;ADMINISTRACAO DO CCS
ADLEY ANTONINI NEVES DE LIMA;11.862,64;PROFESSOR DO MAGISTERIO SUPERIOR;6;602;DEPARTAMENTO DE FARMACIA
ADEMAR LOPES;7.450,48;VIGILANTE;D;;DIVISAO DE SEGURANCA PATRIMONIAL
ADLAREG AUREA DA COSTA DUTRA;4.513,12;CONTADOR;E;;AUDITORIA
ADILSON NUNES DE CARVALHO;6.741,38;TECNICO EM ARTES GRAFICAS;D;;EDITORA UNIVERSITARIA
ADELMO LUIS E SILVA;12.451,63;PROFESSOR ENS BASICO TECN TECNOLOGICO;D;404;CNAT-DIRETORIA ACADEMICA DA INDUSTRIA
ADNA FRANCISCA DA SILVA;5.952,49;AUXILIAR DE ENFERMAGEM;C;;HOSPITAL UNIVERSITARIO ONOFRE LOPES
ADJA FERREIRA DE ANDRADE;11.308,31;PROFESSOR DO MAGISTERIO SUPERIOR;6;602;INSTITUTO METROPOLE DIGITAL
ADEMIR ALVES FERREIRA;7.423,31;VIGILANTE;D;;ESCOLA AGRICOLA DE JUNDIAI - UAECA
ADILA DANIELLY DE SOUZA COSTA;;;;;
ADELENA GONCALVES MAIA;12.132,29;PROFESSOR DO MAGISTERIO SUPERIOR;6;604;DEPARTAMENTO DE ENGENHARIA CIVIL
ADIR FERREIRA DE LIMA;14.774,97;PSICOLOGO-AREA;E;;SERVICO DE PSICOLOGIA APLICADA
ADENYLZA FLAVIA ALVES DE PAIVA;;;;;
ADERSON FARIAS DO NASCIMENTO;16.560,43;PROFESSOR DO MAGISTERIO SUPERIOR;7;703;DEPARTAMENTO DE GEOFISICA
ADEMAR ALEXANDRE DE MORAIS;8.200,45;MEDICO-AREA;E;;HOSPITAL UNIVERSITARIO ONOFRE LOPES
ADRIANA AUGUSTO DE REZENDE;20.259,14;PROFESSOR DO MAGISTERIO SUPERIOR;7;704;DEPTO DE ANALISES CLINIC E TOXICOLOGICAS
ADRIANA BEZERRA NUNES;18.346,22;PROFESSOR DO MAGISTERIO SUPERIOR;7;704;
ADILSON DE LIMA TAVARES;14.709,64;PROFESSOR DO MAGISTERIO SUPERIOR;6;604;ADMINISTRACAO DO CCSA
ADRIANA CAVALCANTE MARQUES;2.768,02;PROFESSOR MAGISTERIO SUPERIOR-TEMPORARIO;4;501;DEPARTAMENTO DE ENGENHARIA DE PRODUCAO
ADEMIR ARAUJO DA COSTA;20.475,30;PROFESSOR DO MAGISTERIO SUPERIOR;8;801;DEPARTAMENTO DE GEOGRAFIA
ADRIANA OLIVEIRA DIAS;6.742,07;ENFERMEIRO-AREA;E;;MATERNIDADE ESCOLA JANUARIO CICCO
ADRIANO DE OLIVEIRA SOUSA;13.263,23;PROFESSOR DO MAGISTERIO SUPERIOR;6;604;DEPTO DE FISICA TEORICA E EXPERIMENTAL
ADRIANNE PAULA VIEIRA DE ANDRADE;6.586,66;PROFESSOR DO MAGISTERIO SUPERIOR;4;502;DEPT DE COMPUTACAO E TECNOLOGIA-CERES
ADRIANA GOMES AMORIM;9.729,94;ODONTOLOGO - 30 HORAS - DL 1445-76;E;;DIRETORIA DE ATENCAO A SAUDE DO SERVIDOR
ADRIANA SZILAGYI LEAO;6.961,61;ASSISTENTE EM ADMINISTRACAO;D;;COLEGIO DE APLICACAO - NEI
ADRIANA DA SILVA CARDOSO;10.231,95;ASSISTENTE EM ADMINISTRACAO;D;;DIRETORIA DE MATERIAL E PATRIMONIO
ADRIANO CARLOS COSTA DE MORAIS;2.777,63;TEC DE TECNOLOGIA DA INFORMACAO;D;;SUPERINTENDENCIA DE INFORMATICA
ADRIANA MARCELLE DE ANDRADE FREITAS;0,00;PROFESSOR DO MAGISTERIO SUPERIOR;4;601;DEPTO DE LING E LITER ESTRANG MODERNAS
ADRIANA GOMES MAGALHAES;9.689,13;PROFESSOR DO MAGISTERIO SUPERIOR;6;601;FACULDADE DE CIENCIAS DA SAUDE DO TRAIRI
ADRIANO BRETANHA LOPES TORT;12.697,76;PROFESSOR DO MAGISTERIO SUPERIOR;6;604;INSTITUTO DO CEREBRO
ADRIANA PAULA DA SILVA ELEUTERIO;10.674,31;ASSISTENTE SOCIAL;E;;HOSPITAL UNIVERSITARIO ONOFRE LOPES
ADRIANA DA SILVA BRITO;11.634,35;PROFESSOR DO MAGISTERIO SUPERIOR;6;602;FACULDADE DE CIENCIAS DA SAUDE DO TRAIRI
ADRIANA FERREIRA UCHOA;16.550,57;PROFESSOR DO MAGISTERIO SUPERIOR;7;702;DEPTO DE BIOLOGIA CELULAR E GENETICA
ADRIANA ISABEL BACKES STEPPAN;11.308,31;PROFESSOR DO MAGISTERIO SUPERIOR;6;602;DEPARTAMENTO DE CIENCIAS CONTABEIS
ADRIANA FERNANDES DUARTE DOS SANTOS;7.405,44;FONOAUDIOLOGO;E;;
ADRIANE CENCI;9.570,41;PROFESSOR DO MAGISTERIO SUPERIOR;4;601;DEPTO DE FUND E POLITICAS DA EDUCACAO
ADRIANA OLIVEIRA FREIRE DE LIMA;5.018,84;AUXILIAR DE ENFERMAGEM;C;;DIRETORIA DE ATENCAO A SAUDE DO SERVIDOR
ADRIANO CALIMAN FERREIRA DA SILVA;12.697,76;PROFESSOR DO MAGISTERIO SUPERIOR;6;604;DEPARTAMENTO DE ECOLOGIA
ADRIANE DENISE FONSECA LOPES;;;;;
ADRIANA NESI DE SA;4.550,32;ASSISTENTE EM ADMINISTRACAO;D;;GABINETE DO REITOR
ADRIANO ARANHA FREIRE;4.939,42;ASSISTENTE EM ADMINISTRACAO;D;;DEPARTAMENTO DE ANTROPOLOGIA
ADRIANA MONTEIRO DE ALMEIDA;16.758,38;PROFESSOR DO MAGISTERIO SUPERIOR;7;702;DEPTO DE BOTANICA E ZOOLOGIA
ADRIANA HENRIQUE DE SOUSA SILVA;7.501,40;AUXILIAR DE ENFERMAGEM;C;;MATERNIDADE ESCOLA JANUARIO CICCO
ADRIANE TRAMONTIN SANTIAGO;6.832,98;ASSIST TECNICO DE GESTAO EM SAUDE;3;;DIRETORIA DE MATERIAL E PATRIMONIO
ADRIANA MARCIA NASCIMENTO DE OLIVEIRA;4.125,01;AUX EM ADMINISTRACAO;C;;DEPTO DE CIENCIAS ATMOSFERICAS E CLIMATI
ADRIANO DE ARAUJO LIMA LIGUORI;13.214,97;PROFESSOR DO MAGISTERIO SUPERIOR;4;402;DEPARTAMENTO DE MEDICINA CLINICA
ADRIANA MARQUES ROBERTO;4.759,79;ASSISTENTE EM ADMINISTRACAO;D;;PRO-REITORIA DE GESTAO DE PESSOAS
ADRIANA DIAS DE ARAUJO;14.622,51;ENFERMEIRO-AREA;E;;HOSPITAL UNIVERSITARIO ONOFRE LOPES
ADRIANA ROSA CARVALHO;11.308,31;PROFESSOR DO MAGISTERIO SUPERIOR;6;602;DEPARTAMENTO DE ECOLOGIA
ADRIANO CHARLES DA SILVA CRUZ;11.709,64;PROFESSOR DO MAGISTERIO SUPERIOR;6;603;DEPARTAMENTO DE COMUNICACAO SOCIAL
AILTON RODRIGUES DA SILVA;9.570,41;PROFESSOR DO MAGISTERIO SUPERIOR;4;601;DEPARTAMENTO DE MATEMATICA
AILTON GOMES CALHEIROS;5.058,71;MOTORISTA;C;;DIVISAO DE TRANSPORTE E OFICINAS
ADRIAO DUARTE DORIA NETO;20.430,13;PROFESSOR DO MAGISTERIO SUPERIOR;8;801;DEPTO DE ENG DE COMPUTACAO E AUTOMACAO
ADRIANO MARINHO DOS SANTOS;3.998,03;TECNICO DE LABORATORIO AREA;D;;DEPARTAMENTO DE ARTES
ADRIANO THIAGO LOPES BERNARDINO;12.607,81;PROFESSOR DO MAGISTERIO SUPERIOR;6;603;CENTRO REG DE ENS SUPERIOR DO SERIDO
AGUINALDO CESAR SURDI;9.570,41;PROFESSOR DO MAGISTERIO SUPERIOR;4;601;DEPARTAMENTO DE EDUCACAO FISICA
ADRIAO FERNANDES PIMENTA;5.700,24;TECNICO DE LABORATORIO AREA;D;;ADMINISTRACAO DO CT
AFONSO DE LIGORIO DANTAS MARTINS;6.735,27;AUX EM ADMINISTRACAO;C;;SUPERINTENDENCIA DE COMUN UNIVERSITARIA
ADRIANO ROCHA GERMANO;16.650,25;PROFESSOR DO MAGISTERIO SUPERIOR;7;703;DEPARTAMENTO DE ODONTOLOGIA
ADRIANO HENRIQUE DO NASCIMENTO RANGEL;16.550,57;PROFESSOR DO MAGISTERIO SUPERIOR;7;702;ESCOLA AGRICOLA DE JUNDIAI - UAECA
ADSON JOSE MARTINS VALE;2.978,81;PROFESSOR DO MAGISTERIO SUPERIOR;5;501;DEPARTAMENTO DE TOCO-GINECOLOGIA
AGOSTINHO JORGE DE LIMA;15.549,18;PROFESSOR DO MAGISTERIO SUPERIOR;7;701;ESCOLA DE MUSICA - UAEM
AGAMENON CLEMENTE DE MORAIS JUNIOR;3.999,80;ASSISTENTE EM ADMINISTRACAO;D;;ESCOLA DE MUSICA - UAEM
ADRIANO LUIS DE CARVALHO ARAUJO;9.498,50;MEDICO-AREA;E;;HOSPITAL UNIVERSITARIO ONOFRE LOPES
ADRIANO DOS SANTOS;15.413,91;PROFESSOR DO MAGISTERIO SUPERIOR;7;702;DEPARTAMENTO DE ENGENHARIA DE PETROLEO
ADRIANO MEDEIROS COSTA;9.768,47;PROFESSOR DO MAGISTERIO SUPERIOR;6;601;DEPARTAMENTO DE COMUNICACAO SOCIAL
ADRIANO MEDEIROS CAMARA;3.058,70;TECNICO EM CONTABILIDADE;D;;DEPARTAMENTO DE CONTABILIDADE E FINANCAS
AGNES FELIX;2.968,78;PROFESSOR MAGISTERIO SUPERIOR-TEMPORARIO;4;401;ESCOLA MULTICAMPI DE CIENCIAS MEDICAS
AFRANIO CESAR DE ARAUJO;16.456,27;PROFESSOR ENS BASICO TECN TECNOLOGICO;D;403;ESCOLA AGRICOLA DE JUNDIAI - UAECA
ADRIANO LIMA TROLEIS;12.471,57;PROFESSOR DO MAGISTERIO SUPERIOR;6;604;DEPARTAMENTO DE GEOGRAFIA
ADRIANO MEDEIROS DE ARAUJO;6.772,08;ASSISTENTE EM ADMINISTRACAO;D;;ADMINISTRACAO DO CERES EM CAICO
AILTON LOURENCO MAIA;4.664,02;RECEPCIONISTA;C;;SUPERINTENDENCIA DE COMUN UNIVERSITARIA
ADRIANO LOPES GOMES;18.128,59;PROFESSOR DO MAGISTERIO SUPERIOR;7;704;DEPARTAMENTO DE COMUNICACAO SOCIAL
AFONSO GALDINO CAMARA DOS SANTOS LIMA;6.772,08;VIGILANTE;D;;DIVISAO DE SEGURANCA PATRIMONIAL
AILTON FLORIANO DA SILVA;7.033,68;ASSISTENTE EM ADMINISTRACAO;D;;DEPARTAMENTO DE ENGENHARIA MECANICA
AGNALDO GARCIA CARDOSO;7.770,15;VIGILANTE;D;;DIVISAO DE SEGURANCA PATRIMONIAL
AFONSO HENRIQUE LAMAS FERNANDES DE OLIVEIRA;12.549,71;MEDICO-AREA;E;;HOSPITAL UNIVERSITARIO ONOFRE LOPES
AGNALDO SOUZA CRUZ;5.051,21;ASSISTENTE EM ADMINISTRACAO;D;;ADMINISTRACAO DO CT
AFRANIO GALDINO DE ARAUJO;17.727,30;PROFESSOR DO MAGISTERIO SUPERIOR;7;704;DEPARTAMENTO DE CIENCIAS ADMINISTRATIVAS
AGOSTINHO DE MEDEIROS BRITO JUNIOR;15.413,91;PROFESSOR DO MAGISTERIO SUPERIOR;7;701;DEPTO DE ENG DE COMPUTACAO E AUTOMACAO
ALANE DE MEDEIROS SILVA;8.520,27;ENFERMEIRO-AREA;E;;DEPARTAMENTO DE ODONTOLOGIA
AIRTON LIMA SANTOS;8.780,68;TECNICO EM ELETROTECNICA;D;;DEPARTAMENTO DE ENGENHARIA MECANICA
AIRTON ANDRE SILVA SALVIANO;3.395,81;ASSISTENTE EM ADMINISTRACAO;D;;DEPARTAMENTO DE CIENCIA DA INFORMACAO
ALAN DANIEL FREIRE DE LACERDA;15.413,91;PROFESSOR DO MAGISTERIO SUPERIOR;7;701;DEPARTAMENTO DE POLITICAS PUBLICAS
AISSA DE FRANCA E SANTANA;9.831,03;MEDICO-AREA;E;;HOSPITAL UNIVERSITARIO ONOFRE LOPES
ALBERTO HAFID DANTAS ASSIS;;;;;
ALANA OLIVEIRA DE ABRANTES;;;;;
ALANA DANTAS FREIRE;;;;;
ALBERTO SEGUNDO SPINOLA DA HORA;5.109,02;ASSISTENTE EM ADMINISTRACAO;D;;DIRETORIA DE ADMINISTRACAO DE PESSOAL
AIRTON SERGIO DA SILVA COSTA;2.744,57;ASSISTENTE EM ADMINISTRACAO;D;;ADMINISTRACAO DO CT
ALBANYRA DOS SANTOS SOUZA;0,00;PROFESSOR MAGISTERIO SUPERIOR-SUBSTITUTO;4;501;DEPARTAMENTO DE LETRAS
ALAN CESAR DOS SANTOS DANTAS;3.555,38;TECNICO DE LABORATORIO AREA;D;;DEPARTAMENTO DE ENGENHARIA MECANICA
ALAN LEAL DE MAGALHAES;;;;;
AIRTON FERNANDES GUIMARAES FILHO;8.160,81;PROFESSOR ENS BASICO TECN TECNOLOGICO;D;302;ESCOLA DE MUSICA - UAEM
AKALINE DANTAS DE ARAUJO;6.837,25;SECRETARIO EXECUTIVO;E;;INSTITUTO DO CEREBRO
ALANE DE FATIMA FERNANDES PEREIRA RODRIGUES;14.010,04;MEDICO-AREA;E;;MATERNIDADE ESCOLA JANUARIO CICCO
ALCIDES DE OLIVEIRA WANDERLEY NETO;13.263,23;PROFESSOR DO MAGISTERIO SUPERIOR;6;604;INSTITUTO DE QUIMICA
ALANNA SIQUEIRA SIMONETTI OLIVEIRA;6.828,02;ADMINISTRADOR;E;;GABINETE DO REITOR
AIRTON DE MORAIS MARINHO;5.171,17;MOTORISTA;C;;DIVISAO DE TRANSPORTE E OFICINAS
AISLANIA ALVES DE ARAUJO;4.008,68;PROFESSOR MAGISTERIO SUPERIOR-SUBSTITUTO;4;501;DEPT DE COMPUTACAO E TECNOLOGIA-CERES
ALANA RODRIGUES GUIMARAES DE AQUINO;;;;;
ALANA CRISTINA BEZERRA DE MEDEIROS SOARES;7.694,25;ASSISTENTE SOCIAL;E;;ADMINISTRACAO DO CERES EM CURRAIS NOVOS
ALBIMAR GONCALVES DE MELLO;15.711,52;TECNICO EM ASSUNTOS EDUCACIONAIS;E;;DEPARTAMENTO DE MATEMATICA
ALCILEA DANTAS DE MEDEIROS;7.980,61;PSICOLOGO-AREA;E;;SERVICO DE PSICOLOGIA APLICADA
ALCILEIA RODRIGUES MARQUES;6.742,07;ENFERMEIRO-AREA;E;;HOSPITAL UNIVERSITARIO ONOFRE LOPES
AIRAN DOS SANTOS BORGES;5.697,61;PROFESSOR DO MAGISTERIO SUPERIOR;4;601;DEPARTAMENTO DE HISTORIA-CERES
AIRTON MINCHONI;-1000;PROFESSOR MAGISTERIO SUPERIOR-SUBSTITUTO;4;401;DEPARTAMENTO DE COMUNICACAO SOCIAL
ALBA KATARINE MARQUES DE CARVALHO;7.694,25;NUTRICIONISTA-HABILITACAO;E;;DIRETORIA DO RESTAURANTE UNIVERSITARIO
ALBERTO ALVES RIBEIRO;7.698,95;TECNICO DE LABORATORIO AREA;D;;INSTITUTO DE QUIMICA
ALBIMAR COSTA DE QUEIROZ;6.581,06;AUXILIAR DE ENFERMAGEM;C;;HOSPITAL UNIVERSITARIO ONOFRE LOPES
ALCIO FARIAS DE AZEVEDO;9.229,59;TECNICO EM ASSUNTOS EDUCACIONAIS;E;;PRO-REITORIA DE POS-GRADUACAO
ALESSANDRO AUGUSTO DE AZEVEDO;15.790,84;PROFESSOR DO MAGISTERIO SUPERIOR;7;701;DEPTO DE PRAT EDUCACIONAIS E CURRICULO
ALESSANDRA CASTILHO FERREIRA DA COSTA;11.709,64;PROFESSOR DO MAGISTERIO SUPERIOR;6;603;DEPARTAMENTO DE LETRAS
ALDA MARIA DUARTE ARAUJO CASTRO;16.456,27;PROFESSOR DO MAGISTERIO SUPERIOR;7;703;ADMINISTRACAO DO CENTRO DE EDUCACAO
ALESSANDRA KARLA FONSECA ELIAS COUTINHO RODRIGUES;7.650,36;MEDICO-AREA;E;;DIRETORIA DE ATENCAO A SAUDE DO SERVIDOR
ALDO CARIELO DO NASCIMENTO FILHO;3.136,77;ASSISTENTE EM ADMINISTRACAO;D;;INSTITUTO METROPOLE DIGITAL
ALESSANDRA PATRICIA LIMA DE ARAUJO;4.493,95;AUXILIAR DE ENFERMAGEM;C;;HOSPITAL UNIVERSITARIO ONOFRE LOPES
ALESSANDRO DA SILVA DANTAS;16.773,43;MEDICO-AREA;E;;HOSPITAL UNIVERSITARIO ONOFRE LOPES
ALESSANDRA PINHEIRO DA SILVA;;;;;
ALEX ARIANO FONTES DA SILVA;;;;;
ALDAYR DANTAS DE ARAUJO;24.997,01;PROFESSOR DO MAGISTERIO SUPERIOR;8;801;PRO-REITORIA DE PESQUISA
ALESSANDRA MENDES PACHECO GUERRA VALE;15.413,91;PROFESSOR ENS BASICO TECN TECNOLOGICO;D;401;ESCOLA AGRICOLA DE JUNDIAI - UAECA
ALESSANDRO AUGUSTO DE BARROS FACANHA;7.244,18;PROFESSOR DO MAGISTERIO SUPERIOR;5;502;DEPARTAMENTO DE EDUCACAO-CERES
ALEX BEIGUI DE PAIVA CAVALCANTE;15.860,21;PROFESSOR DO MAGISTERIO SUPERIOR;7;702;DEPARTAMENTO DE ARTES
ALDO SOUSA DA SILVA;3.330,54;SERVENTE DE LIMPEZA;A;;CENTRO DE TECNOLOGIA
ALEX BRUNNO DO NASCIMENTO MARTINS;;;;;
ALEX DE MOURA BATISTA;9.570,41;PROFESSOR DO MAGISTERIO SUPERIOR;4;601;DEPTO DE CIENCIAS EXATAS E APLICADAS
ALEX CAVALCANTI FEITOSA;5.096,04;TECNICO DE LABORATORIO AREA;D;;DEPARTAMENTO DE ENGENHARIA QUIMICA
ALESSANDRA MARINHO MIRANDA LUCENA;4.861,61;TECNICO DE LABORATORIO AREA;D;;ESCOLA MULTICAMPI DE CIENCIAS MEDICAS
ALESSANDRO DOZENA;12.132,29;PROFESSOR DO MAGISTERIO SUPERIOR;6;604;DEPARTAMENTO DE GEOGRAFIA
ALDO ALOISIO DANTAS DA SILVA;17.383,32;PROFESSOR DO MAGISTERIO SUPERIOR;7;704;GABINETE DO REITOR
ALESSANDRA CAVALCANTE DE SOUZA;;;;;
ALDOMAR PEDRINI;16.411,76;PROFESSOR DO MAGISTERIO SUPERIOR;7;701;DEPARTAMENTO DE ARQUITETURA
ALCIONE ARAUJO SEVERO;5.788,08;AUXILIAR DE ENFERMAGEM;C;;HOSPITAL UNIVERSITARIO ONOFRE LOPES
ALEX DANILO MONTE DE ANDRADE;3.518,27;TECNICO EM AGROPECUARIA;D;;ESCOLA AGRICOLA DE JUNDIAI - UAECA
ALDO PAULINO DE MEDEIROS JUNIOR;7.125,76;MECANICO;C;;DEPARTAMENTO DE ENGENHARIA MECANICA
ALESSANDRA CARDOZO DE FREITAS;12.132,29;PROFESSOR DO MAGISTERIO SUPERIOR;6;604;DEPTO DE PRAT EDUCACIONAIS E CURRICULO
ALDAIR RODRIGUES DA SILVA;6.586,66;PROFESSOR ENS BASICO TECN TECNOLOGICO;D;101;ESCOLA AGRICOLA DE JUNDIAI - UAECA
ALDACI DA SILVA SANTOS;7.015,68;ASSISTENTE EM ADMINISTRACAO;D;;CENTRO REG UNIVERSITARIO DE TREINAMENTO
ALDENOR FERREIRA DA SILVA;3.742,16;COPEIRO;B;;ADMINISTRACAO DO CB
ALEXANDRE HIDEKI OKANO;15.413,91;PROFESSOR DO MAGISTERIO SUPERIOR;7;701;DEPARTAMENTO DE EDUCACAO FISICA
ALEXANDRE LOPES DE FREITAS;2.414,70;AUX EM ADMINISTRACAO;C;;CENTRO DE EDUCACAO
ALEXANDRE BARBOSA DE OLIVEIRA;12.697,76;PROFESSOR DO MAGISTERIO SUPERIOR;6;604;ESCOLA DE CIENCIAS E TECNOLOGIA - UAECT
ALEXANDRE DANTAS OLIVEIRA DE MEDEIROS;1.700,03;AUX EM ADMINISTRACAO;C;;CENTRO DE CIENCIAS SOCIAIS APLICADAS
ALEX SANDRO MACEDO DE OLIVEIRA;9.000,40;PROFESSOR DO MAGISTERIO SUPERIOR;6;601;DEPTO DE CIENCIAS EXATAS E APLICADAS
ALEXANDRE DANTAS DE MEDEIROS FILHO;2.129,80;PROFESSOR MAGISTERIO SUPERIOR-TEMPORARIO;4;401;ESCOLA MULTICAMPI DE CIENCIAS MEDICAS
ALEX FRANCISCO ANTUNES;15.413,91;PROFESSOR DO MAGISTERIO SUPERIOR;7;701;DEPARTAMENTO DE GEOLOGIA
ALEXANDRE DOS SANTOS;7.994,01;PROFESSOR ENS BASICO TECN TECNOLOGICO;D;301;ESCOLA DE MUSICA - UAEM
ALEXANDRE ALMEIDA DE LUCENA;6.131,81;TEC DE TECNOLOGIA DA INFORMACAO;D;;NUCLEO DE MACAU
ALEXANDRE FERREIRA DOS SANTOS;5.452,89;TECNICO DE LABORATORIO AREA;D;;DEPARTAMENTO DE COMUNICACAO SOCIAL
ALEXANDRE FADIGAS DE SOUZA;11.709,64;PROFESSOR DO MAGISTERIO SUPERIOR;6;604;DEPARTAMENTO DE ECOLOGIA
ALEXANDRE DA SILVA AGUIAR;11.308,31;PROFESSOR DO MAGISTERIO SUPERIOR;6;602;CENTRO DE EDUCACAO
ALEXANDRE JOHNSON DOS ANJOS;7.355,88;PROFESSOR DO MAGISTERIO SUPERIOR;6;602;ESCOLA DE MUSICA - UAEM
ALEX RODRIGUES BEZERRA;5.208,27;OPERADOR DE MAQUINA COPIADORA;C;;ADMINISTRACAO DO CT
ALEXANDRE GURGEL DAMASCENO;2.414,70;AUXILIAR DE BIBLIOTECA;C;;BIBLIOTECA CENTRAL ZILA MAMEDE
ALEX JOSE SOUZA DOS SANTOS;7.210,85;PROFESSOR DO MAGISTERIO SUPERIOR;6;603;DEPARTAMENTO DE ODONTOLOGIA
ALEXANDRE MAGNO CAVALCANTI DA ROCHA;5.819,23;PROFESSOR DO MAGISTERIO SUPERIOR;5;502;DEPTO DE OCEANOGRAFIA E LIMNOLOGIA
ALEXANDRE GUIMARAES DAVID;8.306,11;ADMINISTRADOR;E;;PRO-REITORIA DE EXTENSAO UNIVERSITARIA
ALEX ESCALE MARQUES;4.723,78;ASSISTENTE EM ADMINISTRACAO;D;;ESCOLA DE CIENCIAS E TECNOLOGIA - UAECT
ALEX SANDRO FERREIRA DA SILVA;4.001,88;TECNICO EM EDIFICACOES;D;;INSTITUTO DO CEREBRO
ALEX REINECKE DE ALVERGA;9.570,41;PROFESSOR DO MAGISTERIO SUPERIOR;4;601;FACULDADE DE CIENCIAS DA SAUDE DO TRAIRI
ALEXANDRE ANTONIO SILVA DE SOUZA;5.867,05;ASSISTENTE EM ADMINISTRACAO;D;;DEPT DE DIREITO PROCESSUAL PROPEDEUTICA
ALEXANDRE JOSE FARIA CARRILHO;-1000;MEDICO;B;;HOSPITAL UNIVERSITARIO ONOFRE LOPES
ALEXANDRE DE OLIVEIRA LIMA;3.147,69;PROFESSOR MAGISTERIO SUPERIOR-SUBSTITUTO;4;601;DEPARTAMENTO DE ENGENHARIA CIVIL
ALEX MATIAS GOMES;3.259,10;ASSISTENTE EM ADMINISTRACAO;D;;SUPERINTENDENCIA DE INFRA-ESTRUTURA
ALEXANDRE CASTRO GOLLO;2.293,41;PROFESSOR MAGISTERIO SUPERIOR-TEMPORARIO;4;401;DEPTO DE FUND E POLITICAS DA EDUCACAO
ALEXANDRE BEZERRA VIANA;19.369,82;PROFESSOR ENS BASICO TECN TECNOLOGICO;D;501;ESCOLA DE MUSICA - UAEM
ALEXANDRE HENRIQUE BEZERRA GOMES;4.015,19;PROFESSOR DO MAGISTERIO SUPERIOR;5;502;DEPARTAMENTO DE CIRURGIA
ALEXANDRE FLAVIO SILVA DE QUEIROZ;15.942,61;PROFESSOR DO MAGISTERIO SUPERIOR;6;604;GABINETE DO REITOR
ALEXANDRE FAUSTINO LEITE;-1000;PROFESSOR MAGISTERIO SUPERIOR-SUBSTITUTO;4;401;DEPT DE COMPUTACAO E TECNOLOGIA-CERES
ALEXANDRE MAGNO DE SIQUEIRA MARINHO;3.646,53;PROFESSOR ENS BASICO TECN TECNOLOGICO;D;402;ESCOLA AGRICOLA DE JUNDIAI - UAECA
ALINE ARAUJO ALVES DE OLIVEIRA;6.236,93;TECNICO DE LABORATORIO AREA;D;;INSTITUTO DE QUIMICA
ALINE DOS ANJOS LUCAS;3.425,73;AUXILIAR DE ENFERMAGEM;C;;DIRETORIA DE ATENCAO A SAUDE DO SERVIDOR
ALEXIA GUERRA LIMA DE MEDEIROS;3.058,70;ASSISTENTE EM ADMINISTRACAO;D;;ADMINISTRACAO DO CCHLA
ALICE DE MORAES CALVENTE VERSIEUX;12.697,76;PROFESSOR DO MAGISTERIO SUPERIOR;6;604;DEPTO DE BOTANICA E ZOOLOGIA
ALFREDO DE OLIVEIRA NUNES JUNIOR;2.542,40;ASSISTENTE EM ADMINISTRACAO;D;;DEPARTAMENTO DE ECONOMIA
ALEXANDRE PEDRO DA COSTA;5.018,84;AUXILIAR DE ENFERMAGEM;C;;HOSPITAL UNIVERSITARIO ONOFRE LOPES
ALEXSANDRO GALENO ARAUJO DANTAS;16.758,38;PROFESSOR DO MAGISTERIO SUPERIOR;7;702;DEPARTAMENTO DE CIENCIAS SOCIAIS
ALEXSANDRO PEREIRA DE ANDRADE;;;;;
ALINE DA SILVA SANTOS;5.181,45;TECNICO DE LABORATORIO AREA;D;;DEPARTAMENTO DE ENGENHARIA CIVIL
ALEXANDRE RECHE E SILVA;11.308,31;PROFESSOR ENS BASICO TECN TECNOLOGICO;D;302;ESCOLA DE MUSICA - UAEM
ALEXANDRO TEIXEIRA GOMES;17.857,42;PROFESSOR DO MAGISTERIO SUPERIOR;6;602;ADMINISTRACAO DO CERES EM CAICO
ALEXINA LUCIA CALLE DE PAULA WITT;0,00;;;;
ALEXANDRE SANTOS PIMENTA;16.103,21;PROFESSOR DO MAGISTERIO SUPERIOR;7;701;ESCOLA AGRICOLA DE JUNDIAI - UAECA
ALEXEY KUZMIN;9.570,41;PROFESSOR DO MAGISTERIO SUPERIOR;4;601;DEPARTAMENTO DE MATEMATICA
ALIANDA MAIRA CORNELIO DA SILVA;10.666,66;PROFESSOR DO MAGISTERIO SUPERIOR;4;602;DEPARTAMENTO DE MORFOLOGIA
ALEXANDRE MAGNUS FERNANDES GUIMARAES;12.269,51;PROFESSOR DO MAGISTERIO SUPERIOR;6;604;ESCOLA DE CIENCIAS E TECNOLOGIA - UAECT
ALINE CONSTANCIA DE FIGUEIREDO E SOUZA;7.994,01;PROFESSOR ENS BASICO TECN TECNOLOGICO;D;301;COLEGIO DE APLICACAO - NEI
ALEXSANDRA RODRIGUES FEIJAO;12.269,51;PROFESSOR DO MAGISTERIO SUPERIOR;6;603;DEPARTAMENTO DE ENFERMAGEM
ALINE DE PINHO DIAS;12.132,29;PROFESSOR DO MAGISTERIO SUPERIOR;6;604;DEPTO DE FUND E POLITICAS DA EDUCACAO
ALEXSANDRO FERREIRA CARDOSO DA SILVA;12.600,82;PROFESSOR DO MAGISTERIO SUPERIOR;6;604;DEPARTAMENTO DE POLITICAS PUBLICAS
ALINE BRAGA GALVAO SILVEIRA FERNANDES;9.570,41;PROFESSOR DO MAGISTERIO SUPERIOR;4;601;FACULDADE DE CIENCIAS DA SAUDE DO TRAIRI
ALINE DO NASCIMENTO FALCAO FREIRE MONTE;9.729,94;FISIOTERAPEUTA;E;;DEPARTAMENTO DE FISIOTERAPIA
ALEXANDRO BARBOSA;11.778,50;PROFESSOR DO MAGISTERIO SUPERIOR;6;603;DEPARTAMENTO DE CIENCIAS CONTABEIS
ALEXSANDRO JUSTINO DIONISIO;3.703,52;TEC DE TECNOLOGIA DA INFORMACAO;D;;SUPERINTENDENCIA DE INFORMATICA
ALINE BARBOSA XAVIER MUNIZ;8.306,11;TECNICO EM ASSUNTOS EDUCACIONAIS;E;;
ALEXANDRE MELO QUEIROGA;3.359,89;PROFESSOR MAGISTERIO SUPERIOR-SUBSTITUTO;4;401;DEPT DE COMPUTACAO E TECNOLOGIA-CERES
ALINE DE MOURA MATTOS;-1000;PROFESSOR DO MAGISTERIO SUPERIOR;4;601;DEPTO DE PRAT EDUCACIONAIS E CURRICULO
ALEXANDRO OLIVEIRA DA SILVA;3.849,67;ASSISTENTE DE LABORATORIO;C;;HOSPITAL UNIVERSITARIO ONOFRE LOPES
ALIANI COSTA DA SILVA GUIMARAES;2.446,96;ASSISTENTE EM ADMINISTRACAO;D;;PRO-REITORIA DE PESQUISA
ALINE MEDEIROS CAVALCANTI DA FONSECA;7.178,00;PROFESSOR DO MAGISTERIO SUPERIOR;6;601;DEPARTAMENTO DE FISIOTERAPIA
ALLYSON CARVALHO DE ARAUJO;11.709,64;PROFESSOR DO MAGISTERIO SUPERIOR;6;603;DEPARTAMENTO DE EDUCACAO FISICA
ALMIR COSTA DE LIMA;3.564,51;ASSISTENTE EM ADMINISTRACAO;D;;DIRETORIA DE DESENVOLVIMENTO DE PESSOAS
ALMARIA MARIZ BATISTA;5.270,12;PROFESSOR DO MAGISTERIO SUPERIOR;6;601;DEPARTAMENTO DE FARMACIA
ALINE GALUCIO DE OLIVEIRA;8.200,45;ENFERMEIRO-AREA;E;;HOSPITAL UNIVERSITARIO ONOFRE LOPES
ALINE TAVARES MAIA;3.179,41;ASSISTENTE DE LABORATORIO;C;;DEPTO DE OCEANOGRAFIA E LIMNOLOGIA
ALINE SOARES DANTAS;8.306,11;ENGENHEIRO-AREA;E;;SUPERINTENDENCIA DE INFRA-ESTRUTURA
ALLYSON KELLNON NOBREGA DE CARVALHO;2.431,33;AUX EM ADMINISTRACAO;C;;DEPARTAMENTO DE MORFOLOGIA
ALUIZIO JERONIMO FREIRE;7.239,08;VIGILANTE;D;;DIVISAO DE SEGURANCA PATRIMONIAL
ALLYNE FORTES VITOR;12.697,76;PROFESSOR DO MAGISTERIO SUPERIOR;6;604;DEPARTAMENTO DE ENFERMAGEM
ALTAIVA JALES COSTA SOUZA;8.306,11;SANITARISTA;E;;DEPARTAMENTO DE SAUDE COLETIVA
ALINE JARDIM DA FONSECA;3.181,04;ASSISTENTE EM ADMINISTRACAO;D;;DIRETORIA DE ADMINISTRACAO DE PESSOAL
ALLYNE MAYARA DE MEDEIROS BEZERRA;4.155,79;TECNICO DE LABORATORIO AREA;D;;DEPARTAMENTO DE ENGENHARIA QUIMICA
ALMIR DE CARVALHO BUENO;19.469,92;PROFESSOR DO MAGISTERIO SUPERIOR;8;801;DEPARTAMENTO DE HISTORIA-CERES
ALINE SCHWARZ;17.240,94;PROFESSOR DO MAGISTERIO SUPERIOR;7;702;DEPTO DE ANALISES CLINIC E TOXICOLOGICAS
ALMAN MARTINS SANTOS DE LIMA JUNIOR;3.078,37;ASSISTENTE EM ADMINISTRACAO;D;;DEPARTAMENTO DE ESTATISTICA
ALUISIO VIANA DE SOUSA;8.282,40;ASSISTENTE EM ADMINISTRACAO;D;;SUPERINTENDENCIA DE COMUN UNIVERSITARIA
ALLAN ROBSON SILVA VENCESLAU;0,00;PROFESSOR MAGISTERIO SUPERIOR-SUBSTITUTO;4;501;DEPTO DE ENG DE COMPUTACAO E AUTOMACAO
ALINE MEIRY CRUZ DE OLIVEIRA;7.994,33;TECNICO EM ASSUNTOS EDUCACIONAIS;E;;ADMINISTRACAO DO CB
ALMIR MIRANDA FERREIRA;12.154,02;PROFESSOR DO MAGISTERIO SUPERIOR;6;603;DEPTO DE CIENCIAS EXATAS E APLICADAS
ALINE GUERRA GALVAO;8.306,11;ADMINISTRADOR;E;;SUPERINTENDENCIA DE INFRA-ESTRUTURA
ALUIZIO FERREIRA DA ROCHA NETO;10.963,53;PROFESSOR ENS BASICO TECN TECNOLOGICO;D;101;SUPERINTENDENCIA DE INFORMATICA
ALINE PEREIRA DE MEDEIROS;;;;;
ALTENIR GONZAGA DE LIMA;3.671,74;OPERADOR DE MAQ DE LAVANDERIA;A;;MATERNIDADE ESCOLA JANUARIO CICCO
ALINE VIRGINIA MEDEIROS NELSON;9.570,41;PROFESSOR DO MAGISTERIO SUPERIOR;4;601;DEPARTAMENTO DE CIENCIAS ADMINISTRATIVAS
ALINE RODRIGUES DA SILVA;;;;;
ALLAN ROBERTO DIAS NUNES;2.943,90;ASSISTENTE DE LABORATORIO;C;;ESCOLA AGRICOLA DE JUNDIAI - UAECA
ALIPIO DE SOUSA FILHO;20.774,64;PROFESSOR DO MAGISTERIO SUPERIOR;8;801;DEPARTAMENTO DE CIENCIAS SOCIAIS
ALLAN DE MEDEIROS MARTINS;16.103,21;PROFESSOR DO MAGISTERIO SUPERIOR;7;701;DEPARTAMENTO DE ENGENHARIA ELETRICA
ALISSON DE SOUSA LIMA;4.157,95;ASSISTENTE EM ADMINISTRACAO;D;;ADMINISTRACAO DO CT
AMANDA DE MELO CANDIDO;;;;;
