name;money;post;class;level;org
MELYNA SOARES DE SOUTO;3.975,11;TECNICO DE LABORATORIO AREA;D;;DEPARTAMENTO DE MORFOLOGIA
MICHELINE DAMIAO DIAS MOREIRA;7.994,01;PROFESSOR DO MAGISTERIO SUPERIOR;6;601;DEPARTAMENTO DE ENGENHARIA CIVIL
MICHELINE MARIA COSTA DE AZEVEDO;4.157,95;TEC DE TECNOLOGIA DA INFORMACAO;D;;ESCOLA DE SAUDE DA UFRN
MEYRE ESTER SOUSA DE OLIVEIRA;8.523,91;AUXILIAR DE ENFERMAGEM;C;;MATERNIDADE ESCOLA JANUARIO CICCO
MERCES DE FATIMA DOS SANTOS SILVA;5.426,30;PROFESSOR MAGISTERIO SUPERIOR-TEMPORARIO;4;601;ESCOLA MULTICAMPI DE CIENCIAS MEDICAS
MELINA BEZERRA LOUREIRO;3.147,69;PROFESSOR MAGISTERIO SUPERIOR-SUBSTITUTO;4;601;DEPTO DE ANALISES CLINIC E TOXICOLOGICAS
MAYRA CARMEN SILVA DE MEDEIROS;;;;;
MICHAEL ROSENFELD DE PAULA RODRIGUES;5.359,20;FARMACEUTICO;E;;
MELKA SAMAI SILVA JOVINO;;;;;
MERCIA MARIA BRAZ FERREIRA;7.288,11;TECNICO EM ENFERMAGEM;D;;HOSPITAL UNIVERSITARIO ONOFRE LOPES
MEIRE DUARTE PEREGRINO;7.966,20;ASSISTENTE EM ADMINISTRACAO;D;;ADMINISTRACAO DO CCS
MAYARA SANTA ROSA LIMA;2.636,21;PROFESSOR MAGISTERIO SUPERIOR-SUBSTITUTO;4;501;DEPARTAMENTO DE NUTRICAO
MELISSA DOS SANTOS LOPES;9.570,41;PROFESSOR DO MAGISTERIO SUPERIOR;4;601;DEPARTAMENTO DE ARTES
MICHELE NOBREGA ELALI;6.586,66;PROFESSOR DO MAGISTERIO SUPERIOR;4;501;DEPARTAMENTO DE DIREITO PRIVADO
MICHAEL MANFRED HANKE;11.709,64;PROFESSOR DO MAGISTERIO SUPERIOR;6;603;DEPTO DE LING E LITER ESTRANG MODERNAS
MAYARA MADJA FERNANDES MEDEIROS SANTOS;3.386,20;TECNICO DE LABORATORIO AREA;D;;DEPTO DE BIOLOGIA CELULAR E GENETICA
MICHELE DE OLIVEIRA MOURAO HOLANDA;4.679,12;DIAGRAMADOR;D;;EDITORA UNIVERSITARIA
MELQUESEDEQUE DA SILVA FREIRE;7.244,18;PROFESSOR DO MAGISTERIO SUPERIOR;5;502;INSTITUTO DE QUIMICA
MAYARA FERREIRA DE FARIAS;2.768,02;PROFESSOR MAGISTERIO SUPERIOR-SUBSTITUTO;4;501;DEPARTAMENTO DE TURISMO
MILTON DIAS DOS SANTOS;6.772,08;VIGILANTE;D;;DIVISAO DE SEGURANCA PATRIMONIAL
MILTON DE JESUS SANTOS;5.314,95;AUX EM ADMINISTRACAO;C;;HOSPITAL UNIVERSITARIO ONOFRE LOPES
MILENE DOS SANTOS FIGUEIREDO;12.132,29;PROFESSOR ENS BASICO TECN TECNOLOGICO;D;304;COLEGIO DE APLICACAO - NEI
MIGUEL ANGELO FONSECA DE SOUZA;10.459,71;PROFESSOR DO MAGISTERIO SUPERIOR;4;601;INSTITUTO DE QUIMICA
MICHELLE PAIVA CRUZ;7.994,33;ENGENHEIRO-AREA;E;;PRO-REITORIA DE GESTAO DE PESSOAS
MICHELLE FERRET BADIALI;0,00;PROFESSOR MAGISTERIO SUPERIOR-TEMPORARIO;4;601;DEPARTAMENTO DE COMUNICACAO SOCIAL
MICHELLINE DO VALE MACIEL;9.570,41;PROFESSOR DO MAGISTERIO SUPERIOR;4;601;ESCOLA MULTICAMPI DE CIENCIAS MEDICAS
MILLENA FREIRE DELGADO;2.293,41;PROFESSOR MAGISTERIO SUPERIOR-SUBSTITUTO;4;401;DEPARTAMENTO DE ENFERMAGEM
MICHELLE CARNEIRO FONSECA;2.042,32;AUXILIAR DE ENFERMAGEM;C;;COMPLEXO DE ESPORTES E EVENTOS
MIGUEL EDUARDO MORENO ANEZ;20.289,75;PROFESSOR DO MAGISTERIO SUPERIOR;8;801;DEPARTAMENTO DE CIENCIAS ADMINISTRATIVAS
MILTON MORAIS XAVIER JUNIOR;16.312,08;PROFESSOR DO MAGISTERIO SUPERIOR;7;702;DEPARTAMENTO DE GEOFISICA
MILENA OLIVEIRA DE LIRA;-1000;PROFESSOR ENS BASICO TECN TECNOLOGICO;D;101;COLEGIO DE APLICACAO - NEI
MILTON MOABERTON GURGEL PRAXEDES FERNANDES;2.641,55;ASSISTENTE EM ADMINISTRACAO;D;;DEPARTAMENTO DE NUTRICAO
MICHELLE CRISTINE MEDEIROS JACOB;11.085,51;PROFESSOR DO MAGISTERIO SUPERIOR;6;601;DEPARTAMENTO DE NUTRICAO
MICHELLE MARIA DA SILVA;6.333,60;SECRETARIO EXECUTIVO;E;;GABINETE DO REITOR
MILTON JOSE CAMARA DOS SANTOS;17.222,30;TECNICO EM ASSUNTOS EDUCACIONAIS;E;;ADMINISTRACAO DO CENTRO DE EDUCACAO
MICHELLE MEDEIROS DO AMARAL VERISSIMO;8.539,67;FARMACEUTICO BIOQUIMICO;E;;DEPTO DE ANALISES CLINIC E TOXICOLOGICAS
MICHELLE ARAUJO MACHADO;14.726,39;MEDICO-AREA;E;;HOSPITAL MATERNIDADE ANA BEZERRA
MILENA DE MACEDO BARBOSA NASCIMENTO;8.630,04;BIBLIOTECARIO-DOCUMENTALISTA;E;;COLEGIO DE APLICACAO - NEI
MILTON FREIRE GONDIM FILHO;4.320,12;ASSISTENTE EM ADMINISTRACAO;D;;SUPERINTENDENCIA DE INFRA-ESTRUTURA
MIDIA CRISTINA DE MOURA PINTO E SOUZA;8.508,44;TECNICO EM ENFERMAGEM;D;;MATERNIDADE ESCOLA JANUARIO CICCO
MICHELLE DE MEDEIROS MENDES;10.564,24;NUTRICIONISTA-HABILITACAO;E;;DIRETORIA DO RESTAURANTE UNIVERSITARIO
MILKIA JANNE CAMARA MARINHO;3.181,04;ASSISTENTE EM ADMINISTRACAO;D;;FACULDADE DE CIENCIAS DA SAUDE DO TRAIRI
MICHELINE MORAIS COSTA;5.777,13;TECNICO EM HIGIENE DENTAL;D;;HOSPITAL UNIVERSITARIO ONOFRE LOPES
MILVA MARIA FIGUEIREDO DE MARTINO;14.679,91;PROFESSOR MAGISTERIO SUPERIOR -VISITANTE;7;701;DEPARTAMENTO DE ENFERMAGEM
MILTON THIAGO SCHIVANI ALVES;9.570,41;PROFESSOR DO MAGISTERIO SUPERIOR;4;602;DEPTO DE FISICA TEORICA E EXPERIMENTAL
MILTON ALVES DE ARAUJO;5.699,15;MOTORISTA;C;;DIVISAO DE TRANSPORTE E OFICINAS
MICHELLE CEQUEIRA FEITOR;11.709,64;PROFESSOR DO MAGISTERIO SUPERIOR;6;603;DEPARTAMENTO DE ENGENHARIA TEXTIL
MILENA ROSADO DA COSTA;4.001,88;ASSISTENTE EM ADMINISTRACAO;D;;DEPARTAMENTO DE ECOLOGIA
MIDORI HIJIOKA CAMELO;12.132,29;PROFESSOR DO MAGISTERIO SUPERIOR;6;604;DEPTO DE PRAT EDUCACIONAIS E CURRICULO
MOISES ALBERTO CALLE AGUIRRE;12.132,29;PROFESSOR DO MAGISTERIO SUPERIOR;7;701;DEPTO DE DEMOGRAFIA E CIENCIAS ATUARIAIS
MIRIAN MOEMA FILGUEIRA PINHEIRO;18.205,80;PROFESSOR DO MAGISTERIO SUPERIOR;7;703;DEPARTAMENTO DE COMUNICACAO SOCIAL
MIRIAM REGINA CELI DE ESCALA OLIVEIRA;3.178,00;ASSISTENTE DE LABORATORIO;C;;DEPARTAMENTO DE MORFOLOGIA
MIQUEIAS ARAUJO DA SILVA DANTAS;4.617,55;TECNICO DE LABORATORIO AREA;D;;INSTITUTO DE QUIMICA
MIRIAM FARIAS DA SILVA;;;;;
MOACY FERREIRA DOS SANTOS;4.619,79;MONTADOR-SOLDADOR;B;;SUPERINTENDENCIA DE INFRA-ESTRUTURA
MIRALVA RIBEIRO DA CAMARA;3.085,20;SERVENTE DE LIMPEZA;A;;DIRETORIA DE DESENVOLVIMENTO DE PESSOAS
MOISES FELIPE DA COSTA FERNANDES;;;;;
MIRANICE NUNES DOS SANTOS CRIVES;10.070,19;ASSISTENTE SOCIAL;E;;MATERNIDADE ESCOLA JANUARIO CICCO
MOAB PRAXEDES GOMES;12.206,48;PROFESSOR DO MAGISTERIO SUPERIOR;6;602;DEPARTAMENTO DE GEOLOGIA
MIRACY PINHEIRO DE LIMA MELO;4.660,79;COPEIRO;B;;ADMINISTRACAO DO CCSA
MIRIAM VERACLIDES DE OLIVEIRA COSTA;7.027,38;ASSISTENTE EM ADMINISTRACAO;D;;SUPERINTENDENCIA DE INFRA-ESTRUTURA
MOISES SANTOS DA SILVA;5.309,42;TEC EM INSTRUMENTACAO;D;;DEPARTAMENTO DE ENGENHARIA ELETRICA
MIRIAM DA SILVA PAULINO;7.346,47;AUXILIAR DE ENFERMAGEM;C;;HOSPITAL UNIVERSITARIO ONOFRE LOPES
MIRIAM PLAZA PINTO;12.269,51;PROFESSOR DO MAGISTERIO SUPERIOR;6;603;DEPARTAMENTO DE ECOLOGIA
MOEMA DIANA MAMEDE GALVAO;15.556,75;TECNICO EM ASSUNTOS EDUCACIONAIS;E;;BIBLIOTECA CENTRAL ZILA MAMEDE
MOISES HENRIQUE SILVA ARAUJO;2.641,55;ASSISTENTE EM ADMINISTRACAO;D;;DEPARTAMENTO DE TOCO-GINECOLOGIA
MIRIAM DE OLIVEIRA INACIO;12.206,48;PROFESSOR DO MAGISTERIO SUPERIOR;6;602;DEPARTAMENTO DE SERVICO SOCIAL
MIRIAM STELA MARIS DE OLIVEIRA COSTA;40.853,35;PROFESSOR DO MAGISTERIO SUPERIOR;8;801;DEPARTAMENTO DE MORFOLOGIA
MOISES DOMINGOS SOBRINHO;17.531,89;PROFESSOR DO MAGISTERIO SUPERIOR;7;704;DEPTO DE FUND E POLITICAS DA EDUCACAO
MIRNARI MARIA CARDOZO;4.103,22;ASSISTENTE EM ADMINISTRACAO;D;;DIRETORIA DE DESENVOLVIMENTO DE PESSOAS
MOISES ALVES DE SOUSA;6.939,90;VIGILANTE;D;;DIVISAO DE SEGURANCA PATRIMONIAL
MIRLA RODRIGUES PINTO;10.383,89;PROFESSOR ENS BASICO TECN TECNOLOGICO;D;401;
MIRIAN DANTAS DOS SANTOS;12.830,32;ASSISTENTE EM ADMINISTRACAO;D;;PRO-REITORIA DE GESTAO DE PESSOAS
MIRADALVA COSTA DE ANDRADE;6.154,70;AUXILIAR DE ENFERMAGEM;C;;DIRETORIA DE ATENCAO A SAUDE DO SERVIDOR
MOISES FERREIRA DA SILVA FILHO;8.665,95;VIGILANTE;D;;DIVISAO DE SEGURANCA PATRIMONIAL
MOACIR GUILHERMINO DA SILVA;18.304,45;PROFESSOR DO MAGISTERIO SUPERIOR;7;702;DEPARTAMENTO DE ENGENHARIA CIVIL
MIRIAM LIRA ALBANO;3.806,13;COPEIRO;B;;HOSPITAL UNIVERSITARIO ONOFRE LOPES
MIRIA CRISTINA LIMA DE ALMEIDA;5.018,84;AUXILIAR DE ENFERMAGEM;C;;HOSPITAL UNIVERSITARIO ONOFRE LOPES
MOEMA PIGNATARO LIMA;4.418,23;PROFESSOR DO MAGISTERIO SUPERIOR;4;402;DEPARTAMENTO DE PATOLOGIA
MONICA KARINA SANTOS REIS;8.630,04;BIBLIOTECARIO-DOCUMENTALISTA;E;;DEPARTAMENTO DE ODONTOLOGIA
MONIQUE LEITE GALVAO COELHO;;;;;
MORGANA DOS SANTOS MACHADO;;;;;
MONIQUE GABRIELA DAS CHAGAS FAUSTINO ALVES;5.917,09;PROFESSOR DO MAGISTERIO SUPERIOR;4;601;DEPARTAMENTO DE BIOQUIMICA
MONICA CAROLINA DE MIRANDA;14.679,91;PROFESSOR MAGISTERIO SUPERIOR -VISITANTE;7;701;DEPARTAMENTO DE PSICOLOGIA
MOISES VIEIRA DE MELO;11.773,14;PROFESSOR DO MAGISTERIO SUPERIOR;6;603;DEPARTAMENTO DE ENGENHARIA TEXTIL
MORTON LUIZ FARIA DE MEDEIROS;3.821,54;PROFESSOR DO MAGISTERIO SUPERIOR;6;602;DEPARTAMENTO DE DIREITO PUBLICO
MONICA MARIA FERNANDES DE LIMA;8.667,86;PROFESSOR DO MAGISTERIO SUPERIOR;6;604;DEPARTAMENTO DE ARQUITETURA
MONYKA FERREIRA BORGES;;;;;
MONICA MAGALHAES PEREIRA;11.709,64;PROFESSOR DO MAGISTERIO SUPERIOR;6;603;DEPTO DE INFORMATICA E MAT APLICADA
MONICA DE OLIVEIRA SANTANA;7.604,36;AUXILIAR DE ENFERMAGEM;C;;MATERNIDADE ESCOLA JANUARIO CICCO
MONICA FERREIRA LOPES;15.897,44;MEDICO-AREA;E;;HOSPITAL UNIVERSITARIO ONOFRE LOPES
MONICA ESTEVAM DE ARAUJO;4.937,45;AUXILIAR DE ENFERMAGEM;C;;MATERNIDADE ESCOLA JANUARIO CICCO
MONIQUE DE MELO BORGES;6.966,96;ASSISTENTE EM ADMINISTRACAO;D;;ESCOLA DE MUSICA - UAEM
MONIQUE MACEDO FREIRE LIMA;2.446,96;ASSISTENTE EM ADMINISTRACAO;D;;DEPARTAMENTO DE CONTABILIDADE E FINANCAS
MONALISA CARRILHO DE MACEDO;16.565,02;PROFESSOR DO MAGISTERIO SUPERIOR;7;703;DEPARTAMENTO DE FILOSOFIA
MONALISA SOARES MARANHAO DE FREITAS MEDEIROS;11.631,93;ENFERMEIRO-AREA;E;;MATERNIDADE ESCOLA JANUARIO CICCO
MONICA LARISSA PADILHA HONORIO;;;;;
MUIRAKYTAN KENNEDY DE MACEDO;16.137,41;PROFESSOR DO MAGISTERIO SUPERIOR;7;701;DEPARTAMENTO DE HISTORIA-CERES
MONICA MARTINS NOBREGA;11.288,29;PROFESSOR DO MAGISTERIO SUPERIOR;4;501;DEPARTAMENTO DE TOCO-GINECOLOGIA
MONALIZA RAQUEL DO NASCIMENTO;;;;;
MONICA MARIA CALIXTO DE FARIAS ALVES;7.566,94;PROFESSOR DO MAGISTERIO SUPERIOR;5;502;DEPARTAMENTO DE SERVICO SOCIAL
MOYSES MARCIONILO DE SIQUEIRA NETO;6.354,60;HISTORIADOR;E;;MUSEU CAMARA CASCUDO
MOUSANIEL PEREIRA DE ARAUJO;2.720,36;SERVENTE DE LIMPEZA;A;;ADMINISTRACAO DO CT
MONICA BAUMGARDT BAY;7.475,96;PROFESSOR DO MAGISTERIO SUPERIOR;4;501;DEPARTAMENTO DE INFECTOLOGIA
MONACI SANTOS DE ALMEIDA;14.189,49;ENFERMEIRO-AREA;E;;MATERNIDADE ESCOLA JANUARIO CICCO
MURILO OLIVEIRA MELO;2.708,38;AUXILIAR DE CRECHE;C;;COLEGIO DE APLICACAO - NEI
MURILLO MENNA BARRETO DE MELLO JUNIOR;15.840,51;ENGENHEIRO-AREA;E;;DEPTO DE FISICA TEORICA E EXPERIMENTAL
MONICA MARQUES CARVALHO GALLOTTI;8.260,86;PROFESSOR DO MAGISTERIO SUPERIOR;6;604;DEPARTAMENTO DE CIENCIA DA INFORMACAO
MONISE GLEYCE DE ARAUJO PONTES;-1000;PROFESSOR MAGISTERIO SUPERIOR-SUBSTITUTO;4;401;FACULDADE DE CIENCIAS DA SAUDE DO TRAIRI
NADJA DE SA PINTO DANTAS ROCHA;11.862,64;PROFESSOR DO MAGISTERIO SUPERIOR;6;602;DEPARTAMENTO DE PEDIATRIA
NATALIA ARAUJO LIMA OLIVEIRA;12.143,31;ENFERMEIRO DO TRABALHO;E;;DIRETORIA DE ATENCAO A SAUDE DO SERVIDOR
NATALIA DOS SANTOS LUCENA NETA;3.847,96;ASSISTENTE EM ADMINISTRACAO;D;;DIR DE GESTAO E FISCALIZACAO DE CONTRATO
MYLLENA DO VALE MACIEL DINIZ FERREIRA;14.726,39;MEDICO-AREA;E;;HOSPITAL MATERNIDADE ANA BEZERRA
NAISANDRA BEZERRA DA SILVA FARIAS;14.063,23;PROFESSOR DO MAGISTERIO SUPERIOR;6;604;DEPARTAMENTO DE MORFOLOGIA
NAIRE JANE CAPISTRANO;18.386,40;PROFESSOR ENS BASICO TECN TECNOLOGICO;D;404;COLEGIO DE APLICACAO - NEI
NATALIA MARTINS QUEIROZ;4.180,66;TECNICO EM ASSUNTOS EDUCACIONAIS;E;;PRO-REITORIA DE ASSUNTOS ESTUDANTIS
NASTASSJA MORGANA DE SOUSA FIGUEIREDO;;;;;
NANCY CRISTINA BAUMGARTNER FERNANDES DE BARROS;4.700,54;PROFESSOR DO MAGISTERIO SUPERIOR;5;501;DEPARTAMENTO DE MEDICINA CLINICA
NADJA MARIA DOS SANTOS TRINDADE;10.223,64;TECNICO EM ENFERMAGEM;D;;MATERNIDADE ESCOLA JANUARIO CICCO
NARA CRISTINA FRUTUOSO FERREIRA;3.964,06;TECNICO DE LABORATORIO AREA;D;;DEPARTAMENTO DE FARMACIA
MYCHELLE DE MEDEIROS GARCIA TORRES;20.632,96;MEDICO-AREA;E;;MATERNIDADE ESCOLA JANUARIO CICCO
NADSON FREDERICO DE SIQUEIRA MEDEIROS;;;;;
NAIRA NEIDE CIOTTI;11.709,64;PROFESSOR DO MAGISTERIO SUPERIOR;6;603;DEPARTAMENTO DE ARTES
NATALIA MEDEIROS DOS SANTOS;2.446,96;TECNICO EM EDIFICACOES;D;;SUPERINTENDENCIA DE INFRA-ESTRUTURA
NADJA CALDAS LOPES CARDOSO;35.874,38;PROFESSOR DO MAGISTERIO SUPERIOR;6;604;DEPARTAMENTO DE DIREITO PRIVADO
NALVA MARIA BARBOSA SILVA;7.308,00;ASSISTENTE EM ADMINISTRACAO;D;;HOSPITAL UNIVERSITARIO ONOFRE LOPES
NAI CHENG CHAO;16.295,87;PROFESSOR DO MAGISTERIO SUPERIOR;7;701;DEPTO DE FISICA TEORICA E EXPERIMENTAL
NAINA LEITE DE LIMA;3.847,96;ASSISTENTE EM ADMINISTRACAO;D;;DIRETORIA DE DESENVOLVIMENTO DE PESSOAS
NARA GRACA SALLES;17.354,44;PROFESSOR DO MAGISTERIO SUPERIOR;7;703;DEPARTAMENTO DE ARTES
NAIANNE KELLY CLEBIS;17.240,94;PROFESSOR DO MAGISTERIO SUPERIOR;7;702;DEPARTAMENTO DE MORFOLOGIA
NADIA AURORA VANTI VITULLO;12.132,29;PROFESSOR DO MAGISTERIO SUPERIOR;6;604;DEPARTAMENTO DE CIENCIA DA INFORMACAO
NAICHE ABDON MIRANDA;5.022,39;TECNICO DE LABORATORIO AREA;D;;DEPARTAMENTO DE FISIOLOGIA
NAIYAN HARI CANDIDO LIMA;6.859,94;ENGENHEIRO-AREA;E;;DEPARTAMENTO DE GEOFISICA
MURILO REBELATO OTTAVIANI;3.847,96;ASSISTENTE EM ADMINISTRACAO;D;;PRO-REITORIA DE GESTAO DE PESSOAS
NARA DE SOUZA MOURA;3.847,96;ASSISTENTE EM ADMINISTRACAO;D;;SUPERINTENDENCIA DE INFORMATICA
NATALIA REJANE DE ALMEIDA;;;;;
NAIRA BEATRIZ PINTO RAULINO LADISLAO;14.600,95;ENFERMEIRO-AREA;E;;HOSPITAL UNIVERSITARIO ONOFRE LOPES
MYLENA TAISE AZEVEDO LIMA BEZERRA;18.037,79;MEDICO-AREA;E;;HOSPITAL UNIVERSITARIO ONOFRE LOPES
NATALIA KEILA SOUZA DA SILVA;2.408,08;PROFESSOR MAGISTERIO SUPERIOR-SUBSTITUTO;4;401;DEPARTAMENTO DE ENGENHARIA CIVIL
NEIL DE OLIVEIRA LIMA FILHO;11.709,64;PROFESSOR DO MAGISTERIO SUPERIOR;6;603;DEPARTAMENTO DE ENGENHARIA TEXTIL
NELSON ROMERO DA SILVA SIQUEIRA;5.797,68;TECNICO EM PROTESE DENTARIA;D;;DEPARTAMENTO DE ODONTOLOGIA
NATANY DE SOUZA BATISTA MEDEIROS;5.434,85;PSICOLOGO-AREA;E;;ESCOLA MULTICAMPI DE CIENCIAS MEDICAS
NATHALIA ALINE SILVA DOS SANTOS SOARES DE ARAUJO;3.703,52;ASSISTENTE EM ADMINISTRACAO;D;;DIRETORIA DE DESENVOLVIMENTO PEDAGOGICO
NELSON ION DE OLIVEIRA;4.446,51;PROFESSOR ENS BASICO TECN TECNOLOGICO;D;101;INSTITUTO METROPOLE DIGITAL
NEDJA SUELY FERNANDES;17.861,47;PROFESSOR DO MAGISTERIO SUPERIOR;7;703;INSTITUTO DE QUIMICA
NATHALIA LOUISE GOMES DO ROSARIO ALVES DA MOTA;0,00;;;;
NEILSON DUDA ASSUNCAO;5.034,51;ASSISTENTE EM ADMINISTRACAO;D;;ADMINISTRACAO DO CCS
NATHALYA JULIANNY DE MACEDO OLIMPIO;;;;;
NAYDA BABEL ALVES DE LIMA;;;;;
NAYARA PRISCILA DANTAS DE OLIVEIRA;;;;;
NATHALIA AVILA DO NASCIMENTO NOBREGA;2.058,42;ASSISTENTE EM ADMINISTRACAO;D;;DEPARTAMENTO DE BIOQUIMICA
NELI CRISTINA PINTO DA COSTA ALBUQUERQUE DE ARRUDA;21.587,15;MEDICO-AREA;E;;DIRETORIA DE ATENCAO A SAUDE DO SERVIDOR
NEILMA AZEVEDO DE MEDEIROS;8.257,95;ASSISTENTE EM ADMINISTRACAO;D;;DEPARTAMENTO DE CONTABILIDADE E FINANCAS
NAYARA DA SILVA PONTES;;;;;
NATERCIO NATANAEL DA SILVA MIRANDA;2.590,63;ASSISTENTE DE ALUNO;C;;CENTRO DE CIENC HUMANAS LETRAS E ARTES
NATANIA TUANNY DAMASCENO INACIO;;;;;
NATHALY MARINHO COELHO DA COSTA;4.843,02;TECNICO DE LABORATORIO AREA;D;;DEPARTAMENTO DE NUTRICAO
NATALIE CHRISTINE BRAZ FERNANDES;;;;;
NELSON FERREIRA DE SOUSA JUNIOR;7.178,00;PROFESSOR DO MAGISTERIO SUPERIOR;5;501;DEPARTAMENTO DE LETRAS
NATHANY LOUIZE DE ARAUJO;;;;;
NEIDA DA MATA;11.956,03;FARMACEUTICO BIOQUIMICO;E;;DEPTO DE BIOFISICA E FARMACOLOGIA
NEEMIAS ALVES DE LIMA;12.132,29;PROFESSOR DO MAGISTERIO SUPERIOR;6;604;ESCOLA DE CIENCIAS E TECNOLOGIA - UAECT
NATASHA MEDEIROS HART BARBOSA;4.320,12;ASSISTENTE EM ADMINISTRACAO;D;;GABINETE DO REITOR
NELSON ROBERTO SALUSTINO GALVAO;12.396,90;MEDICO-AREA;E;;HOSPITAL UNIVERSITARIO ONOFRE LOPES
NELIO ALESSANDRO AZEVEDO CACHO;13.023,47;PROFESSOR DO MAGISTERIO SUPERIOR;7;701;DEPTO DE INFORMATICA E MAT APLICADA
NATHALIA GABRIELLE HENRIQUE BEZERRA DE FREITAS;;;;;
NELSON DOS SANTOS ALVES;4.484,28;AUX EM ADMINISTRACAO;C;;MATERNIDADE ESCOLA JANUARIO CICCO
NATJA ARAUJO ALVES;;;;;
NAZINEIDE BRITO;12.569,24;PROFESSOR DO MAGISTERIO SUPERIOR;6;603;DEPARTAMENTO DE EDUCACAO-CERES
NELY HOLLAND;18.246,88;PROFESSOR DO MAGISTERIO SUPERIOR;7;704;DEPARTAMENTO DE NUTRICAO
NERIVANIA NUNES GODEIRO;4.861,61;TECNICO DE LABORATORIO AREA;D;;HOSPITAL UNIVERSITARIO ONOFRE LOPES
NESIO ANTONIO MOREIRA TEIXEIRA DE BARROS;9.663,58;PROFESSOR DO MAGISTERIO SUPERIOR;6;604;ESCOLA AGRICOLA DE JUNDIAI - UAECA
NESTOR RODRIGUES DE OLIVEIRA NETO;27.375,49;MEDICO-AREA;E;;HOSPITAL UNIVERSITARIO ONOFRE LOPES
NEUMA MARIA DA SILVA;12.129,54;ENFERMEIRO-AREA;E;;DIRETORIA DE ATENCAO A SAUDE DO SERVIDOR
NELSON WAGNER ESPINOLA DOS ANJOS;6.236,53;VIGILANTE;D;;DIVISAO DE SEGURANCA PATRIMONIAL
NELY FERREIRA DOS SANTOS;8.630,04;ECONOMISTA;E;;PRO-REITORIA DE EXTENSAO UNIVERSITARIA
NEUCIANE GOMES DA SILVA;19.559,73;PROFESSOR DO MAGISTERIO SUPERIOR;7;704;DEPARTAMENTO DE PSICOLOGIA
NELSON TEMISTOCLES DE BRITO;8.097,83;VIGILANTE;D;;DIVISAO DE SEGURANCA PATRIMONIAL
NEUMA MARINHO DE QUEIROZ SANTOS;4.700,54;PROFESSOR DO MAGISTERIO SUPERIOR;5;501;DEPARTAMENTO DE MEDICINA CLINICA
NEUSA SALES MENDES;15.922,22;ODONTOLOGO - 30 HORAS - DL 1445-76;E;;DEPARTAMENTO DE ODONTOLOGIA
NERIDEUS ALMEIDA DE MACEDO;7.210,56;ASSISTENTE EM ADMINISTRACAO;D;;DIRETORIA DE ADMINISTRACAO DE PESSOAL
NEYSE SIQUEIRA CARDOSO;5.222,57;PROFESSOR ENS BASICO TECN TECNOLOGICO;D;102;COLEGIO DE APLICACAO - NEI
NEYMAR PEREIRA DA COSTA;8.630,04;FISICO;E;;DEPARTAMENTO DE GEOFISICA
NG HAIG THEY;5.426,30;PROFESSOR MAGISTERIO SUPERIOR-SUBSTITUTO;4;601;DEPTO DE OCEANOGRAFIA E LIMNOLOGIA
NEUSIENE MEDEIROS DA SILVA;2.956,50;ASSISTENTE DE ALUNO;C;;FACULDADE DE CIENCIAS DA SAUDE DO TRAIRI
NILBERTO FERREIRA GALVAO;4.664,51;AUXILIAR DE ENFERMAGEM;C;;MATERNIDADE ESCOLA JANUARIO CICCO
NILA PATRICIA FREIRE PEQUENO;7.994,01;PROFESSOR DO MAGISTERIO SUPERIOR;6;601;DEPARTAMENTO DE NUTRICAO
NEY MOURA LEMOS PEREIRA;8.542,85;PROFESSOR DO MAGISTERIO SUPERIOR;6;602;DEPARTAMENTO DE FARMACIA
NICOLE LEITE GALVAO COELHO;12.697,76;PROFESSOR DO MAGISTERIO SUPERIOR;6;604;DEPARTAMENTO DE FISIOLOGIA
NILBA LIMA DE SOUZA;12.923,94;PROFESSOR DO MAGISTERIO SUPERIOR;6;604;DEPARTAMENTO DE ENFERMAGEM
NIEDSON RICARDO DE OLIVEIRA MORAIS;7.967,90;TECNICO EM ASSUNTOS EDUCACIONAIS;E;;INSTITUTO METROPOLE DIGITAL
NEYSE PATRICIA DO NASCIMENTO MENDES;10.674,31;ENFERMEIRO-AREA;E;;HOSPITAL UNIVERSITARIO ONOFRE LOPES
NEYJMME DE FATIMA MEDEIROS;6.580,61;TECNICO EM ASSUNTOS EDUCACIONAIS;E;;PRO-REITORIA DE GRADUACAO
NIEGIA GRACIELY DE MEDEIROS ALVES;;;;;
NILDA DE ARAUJO LIMA;10.308,89;TECNICO EM ASSUNTOS EDUCACIONAIS;E;;DEPARTAMENTO DE GEOLOGIA
NICOLAU APOENA CASTRO;11.308,31;PROFESSOR DO MAGISTERIO SUPERIOR;6;602;DEPARTAMENTO DE ENGENHARIA DE MATERIAIS
NICOLE NAHARA SOUZA DE OLIVEIRA;3.078,37;ASSISTENTE EM ADMINISTRACAO;D;;DEPARTAMENTO DE COMUNICACAO SOCIAL
NEYRE GUIMARAES MARTINS;2.939,63;AUXILIAR DE LABORATORIO;B;;DEPARTAMENTO DE ODONTOLOGIA
NILBERTO GOMES DE SOUSA;8.630,04;ARQUITETO E URBANISTA;E;;SUPERINTENDENCIA DE INFRA-ESTRUTURA
NIVIA MARIA RODRIGUES ARRAIS;16.181,67;PROFESSOR DO MAGISTERIO SUPERIOR;5;502;DEPARTAMENTO DE PEDIATRIA
NILMA DIAS LEAO COSTA;18.778,01;PROFESSOR DO MAGISTERIO SUPERIOR;7;704;DEPARTAMENTO DE SAUDE COLETIVA
NIVIA JERONIMO BEZERRA SILVA DO NASCIMENTO;15.670,54;ENFERMEIRO-AREA;E;;MATERNIDADE ESCOLA JANUARIO CICCO
NIREIDE DE SOUSA CARDOSO SALES;6.812,59;ASSISTENTE EM ADMINISTRACAO;D;;ADMINISTRACAO DO CCET
NILSON MARQUES DE CASTRO;4.843,36;AUXILIAR DE ENFERMAGEM;C;;DIRETORIA DE ATENCAO A SAUDE DO SERVIDOR
NILMA OLIVEIRA DE SOUZA MENESES;7.803,03;TECNICO EM ENFERMAGEM;D;;HOSPITAL UNIVERSITARIO ONOFRE LOPES
NORMA KELLY FREIRE LIMA;10.585,81;FARMACEUTICO BIOQUIMICO;E;;HOSPITAL UNIVERSITARIO ONOFRE LOPES
NUBIA MARIA FREIRE VIEIRA LIMA;10.217,56;PROFESSOR DO MAGISTERIO SUPERIOR;4;602;FACULDADE DE CIENCIAS DA SAUDE DO TRAIRI
NILZA PIRES;20.289,75;PROFESSOR DO MAGISTERIO SUPERIOR;8;801;DEPTO DE FISICA TEORICA E EXPERIMENTAL
NILMA DA SILVA RAMIRO;5.430,89;AUXILIAR DE LABORATORIO;B;;DEPARTAMENTO DE FARMACIA
NUBIA MARIA LIMA DE SOUSA;13.681,05;ENFERMEIRO-AREA;E;;MATERNIDADE ESCOLA JANUARIO CICCO
NOEMEA ROSA DA SILVA;4.443,25;AUX EM ADMINISTRACAO;C;;SUPERINTENDENCIA DE INFRA-ESTRUTURA
NKARTHE GUERRA ARAUJO;3.964,06;TECNICO EM ALIMENTOS E LATICINIOS;D;;ESCOLA AGRICOLA DE JUNDIAI - UAECA
NILTON LEITE DE SOUSA JUNIOR;4.317,87;TECNICO DE LABORATORIO AREA;D;;DEPARTAMENTO DE ENGENHARIA CIVIL
NIVALDO DE ALBUQUERQUE MELO;4.664,51;AUXILIAR DE ENFERMAGEM;C;;HOSPITAL UNIVERSITARIO ONOFRE LOPES
NILSON TEMISTOCLES DE BRITO;8.907,25;VIGILANTE;D;;DIVISAO DE SEGURANCA PATRIMONIAL
NILSON BEZERRA ALVES;5.592,36;CONTINUO;C;;DIRETORIA DE GESTAO DA INFORMACAO
NILO LOURIVAL FERREIRA JUNIOR;14.867,08;ESTATISTICO;E;;DEPARTAMENTO DE INFECTOLOGIA
NIZIA MARIA DE LIMA;3.205,51;SERVENTE DE LIMPEZA;A;;DEPARTAMENTO DE MATEMATICA
NORMA REJANE PEREIRA DE MACEDO;11.645,80;TECNOLOGO-FORMACAO;E;;NUCLEO TECNOLOGIA INDUSTRIAL
NIVIA BEZERRA DE ALMEIDA HALMENSCHLAGER;7.650,36;ODONTOLOGO - 40 HORAS;E;;DIRETORIA DE ATENCAO A SAUDE DO SERVIDOR
NOMINANDO ANDRADE DE OLIVEIRA;12.748,98;PROFESSOR DO MAGISTERIO SUPERIOR;6;604;ESCOLA AGRICOLA DE JUNDIAI - UAECA
NILZA FRANCA MAGALHAES;9.561,61;TECNICO EM CONTABILIDADE;D;;DEPARTAMENTO DE CONTABILIDADE E FINANCAS
NIR COHEN;18.895,71;PROFESSOR DO MAGISTERIO SUPERIOR;8;801;DEPARTAMENTO DE MATEMATICA
NILSON SENA DE ALMEIDA FILHO;3.998,03;ASSISTENTE EM ADMINISTRACAO;D;;ESCOLA DE CIENCIAS E TECNOLOGIA - UAECT
NOELIA SOUZA DOS SANTOS;5.426,30;PROFESSOR MAGISTERIO SUPERIOR-SUBSTITUTO;4;601;DEPTO DE FISICA TEORICA E EXPERIMENTAL
NIOMAR CHRISTINA DE FARIAS DANTAS;4.249,29;ASSISTENTE EM ADMINISTRACAO;D;;ADMINISTRACAO DO CCET
NIZETE GOMES PEREIRA MARTINS;5.895,37;ASSISTENTE EM ADMINISTRACAO;D;;DEPARTAMENTO DE CONTABILIDADE E FINANCAS
NOELI VITORINO LUSTOSA;6.837,25;SECRETARIO EXECUTIVO;E;;ADMINISTRACAO DO CCSA
NORBERTO BATISTA DE FARIA JUNIOR;3.965,36;PROFESSOR DO MAGISTERIO SUPERIOR;6;601;DEPARTAMENTO DE ODONTOLOGIA
OLAVO FONTES MAGALHAES BESSA;13.023,47;PROFESSOR DO MAGISTERIO SUPERIOR;6;604;DEPARTAMENTO DE ARTES
OLAVO LUIZ DE MACEDO CHAGAS;3.305,12;PROGRAMADOR DE RADIO E TELEVISAO;C;;SUPERINTENDENCIA DE COMUN UNIVERSITARIA
OSSIAN FERNANDES DA COSTA;7.365,86;ASSISTENTE EM ADMINISTRACAO;D;;DEPARTAMENTO DE ODONTOLOGIA
OSVALDO CHIAVONE FILHO;20.801,69;PROFESSOR DO MAGISTERIO SUPERIOR;8;801;DEPARTAMENTO DE ENGENHARIA QUIMICA
NURIA MARIA NIETO NUNEZ;8.586,66;PROFESSOR DO MAGISTERIO SUPERIOR;4;501;DEPARTAMENTO DE LETRAS CERES
ODILENO FERNANDES;6.658,55;VIGILANTE;D;;DIVISAO DE SEGURANCA PATRIMONIAL
OSCAR DO NASCIMENTO;5.846,40;ASSISTENTE EM ADMINISTRACAO;D;;MUSEU CAMARA CASCUDO
ODILENE MARIA DE OLIVEIRA;5.379,69;AUXILIAR DE ENFERMAGEM;C;;MATERNIDADE ESCOLA JANUARIO CICCO
ORLANDO AUGUSTO DE FIGUEREDO FILHO;13.442,35;PROFESSOR DO MAGISTERIO SUPERIOR;6;604;DEPARTAMENTO DE GEOLOGIA
ORIVALDO PIMENTEL LOPES JUNIOR;16.847,74;PROFESSOR DO MAGISTERIO SUPERIOR;7;703;DEPARTAMENTO DE CIENCIAS SOCIAIS
OSCAR FEDERICO BAUCHWITZ;19.395,39;PROFESSOR DO MAGISTERIO SUPERIOR;8;801;DEPARTAMENTO DE FILOSOFIA
OCTAVIO CARVALHO DE SOUZA MOREIRA;9.266,14;TEC EM TELECOMUNICACAO;D;;SUPERINTENDENCIA DE INFRA-ESTRUTURA
ORGIVAL BEZERRA DA NOBREGA JUNIOR;16.342,03;PROFESSOR DO MAGISTERIO SUPERIOR;7;702;DEPARTAMENTO DE GEOGRAFIA
ODILIO JUNIOR LINHARES;7.657,63;VIGILANTE;D;;ADMINISTRACAO DO CERES EM CAICO
OBERLAN DE OLIVEIRA LIMA MEDEIROS;3.564,51;TECNICO DE LABORATORIO AREA;D;;SUPERINTENDENCIA DE INFRA-ESTRUTURA
ORIVALDO VIEIRA DE SANTANA JUNIOR;9.570,41;PROFESSOR DO MAGISTERIO SUPERIOR;4;601;ESCOLA DE CIENCIAS E TECNOLOGIA - UAECT
ODIRLEI SILVA JESUS;13.023,47;PROFESSOR DO MAGISTERIO SUPERIOR;6;604;DEPARTAMENTO DE MATEMATICA
NUBIA RIBEIRO JOSINO NASCIMENTO;8.622,33;ASSISTENTE EM ADMINISTRACAO;D;;DIVISAO DE SEGURANCA PATRIMONIAL
ONELIA MARIA GALVAO RODRIGUES;12.816,84;SECRETARIO EXECUTIVO;E;;DEPARTAMENTO DE ODONTOLOGIA
ORIONE DANTAS DE MEDEIROS;12.673,90;PROFESSOR DO MAGISTERIO SUPERIOR;6;603;DEPARTAMENTO DE DIREITO-CERES
OLAVO AMARO PEREIRA;6.157,56;VIGILANTE;D;;DIVISAO DE SEGURANCA PATRIMONIAL
ODARA RAQUEL KUNKLER;4.008,68;PROFESSOR MAGISTERIO SUPERIOR-SUBSTITUTO;4;501;DEPTO DE PRAT EDUCACIONAIS E CURRICULO
OLGA MARIA DOS SANTOS;15.042,54;TECNICO EM ASSUNTOS EDUCACIONAIS;E;;BIBLIOTECA CENTRAL ZILA MAMEDE
OLIVIA MORAIS DE MEDEIROS NETA;9.570,41;PROFESSOR DO MAGISTERIO SUPERIOR;4;601;DEPTO DE FUND E POLITICAS DA EDUCACAO
OLGA CARLA ESPINOLA DA HORA E SOUZA;8.157,37;PROFESSOR ENS BASICO TECN TECNOLOGICO;D;301;ESCOLA AGRICOLA DE JUNDIAI - UAECA
ORISON MARDEN BANDEIRA DE MELO JUNIOR;10.468,58;PROFESSOR DO MAGISTERIO SUPERIOR;4;601;DEPTO DE LING E LITER ESTRANG MODERNAS
ONEIDE MARIA GALVAO RODRIGUES MOURA;6.270,95;AUXILIAR DE ENFERMAGEM;C;;HOSPITAL UNIVERSITARIO ONOFRE LOPES
OLAVO FRANCISCO DOS SANTOS JUNIOR;20.286,57;PROFESSOR DO MAGISTERIO SUPERIOR;8;801;DEPARTAMENTO DE ENGENHARIA CIVIL
ONILDO BRAGA DE OLIVEIRA;2.542,40;TEC DE TECNOLOGIA DA INFORMACAO;D;;ESCOLA AGRICOLA DE JUNDIAI - UAECA
OLAVO BILAC DOS SANTOS;6.939,90;VIGILANTE;D;;DIVISAO DE SEGURANCA PATRIMONIAL
PAMELA DE MEDEIROS BRANDAO;9.570,41;PROFESSOR DO MAGISTERIO SUPERIOR;4;601;DEPARTAMENTO DE CIENCIAS ADMINISTRATIVAS
PALLOMA KARLLA PEREIRA RANGEL LOPES;;;;;
PABLO DE SOUSA SEIXAS;10.468,58;PROFESSOR DO MAGISTERIO SUPERIOR;4;601;FACULDADE DE CIENCIAS DA SAUDE DO TRAIRI
PATRICIA CARLA SANTOS DE MORAIS;;;;;
PAMELA RAISSA PEREIRA MACHADO;2.708,38;AUX EM ADMINISTRACAO;C;;DIRETORIA DE DESENVOLVIMENTO DE PESSOAS
PABLO DANIEL SOARES DA SILVA;2.962,82;ASSISTENTE EM ADMINISTRACAO;D;;INSTITUTO METROPOLE DIGITAL
OTACILIO DOS SANTOS SILVEIRA NETO;12.132,29;PROFESSOR DO MAGISTERIO SUPERIOR;6;604;DEPARTAMENTO DE DIREITO PUBLICO
PABLO SEBASTIAN MOREIRA FERNANDEZ;9.570,41;PROFESSOR DO MAGISTERIO SUPERIOR;4;601;DEPTO DE PRAT EDUCACIONAIS E CURRICULO
OTOM ANSELMO DE OLIVEIRA;30.756,69;PROFESSOR DO MAGISTERIO SUPERIOR;8;801;INSTITUTO DE QUIMICA
OTONIEL DANTAS FERNANDES;5.378,77;MECANICO;C;;PRO-REITORIA DE ADMINISTRACAO
PATRICIA ANGELICA DE MIRANDA SILVA NOGUEIRA;12.697,76;PROFESSOR DO MAGISTERIO SUPERIOR;7;701;DEPARTAMENTO DE FISIOTERAPIA
PALOMA KAROLINE DA SILVA BRASIL;;;;;
OTANIO REVOREDO COSTA;4.679,12;ASSISTENTE EM ADMINISTRACAO;D;;DEPARTAMENTO DE CIENCIAS SOCIAIS
PAMELA KATHERINE NELSON CAMPERO;;;;;
OSVALDO DE FREITAS NETO;10.459,71;PROFESSOR DO MAGISTERIO SUPERIOR;4;601;DEPARTAMENTO DE ENGENHARIA CIVIL
PATRICIA BRANDAO DE MEDEIROS;;;;;
OSWALDO GOMES CORREA NEGRAO;11.085,51;PROFESSOR DO MAGISTERIO SUPERIOR;6;601;DEPARTAMENTO DE SAUDE COLETIVA
