name;money;post;class;level;org
JULIANNE PEREIRA DOS SANTOS;4.209,12;PROFESSOR ENS BASICO TECN TECNOLOGICO;D;101;ESCOLA AGRICOLA DE JUNDIAI - UAECA
JULIO CEZAR BARBOSA LOPES DE OLIVEIRA;3.998,03;TEC EM SEGURANCA DO TRABALHO;D;;DIRETORIA DE ATENCAO A SAUDE DO SERVIDOR
JULIO GOMES JUNIOR;17.253,86;PROFESSOR ENS BASICO TECN TECNOLOGICO;D;403;ESCOLA AGRICOLA DE JUNDIAI - UAECA
JULYANA DE PAULA ARAUJO FERREIRA;;;;;
JUSCIANO MARCIO BRUNO VIDAL;7.363,19;MEDICO-AREA;E;;HOSPITAL UNIVERSITARIO ONOFRE LOPES
JULIO CESAR LEONCIO DA SILVA;4.679,12;TEC DE TECNOLOGIA DA INFORMACAO;D;;SECRETARIA DE EDUCAÇAO A DISTANCIA
JUNA MARIA FERNANDES VIEIRA;6.039,97;AUXILIAR DE ENFERMAGEM;C;;MATERNIDADE ESCOLA JANUARIO CICCO
JUSCELINO NECO DE SOUZA JUNIOR;5.426,30;PROFESSOR MAGISTERIO SUPERIOR-SUBSTITUTO;4;601;DEPARTAMENTO DE ARTES
JULIO CESAR MENDES E SILVA;8.039,95;PROFESSOR DO MAGISTERIO SUPERIOR;6;604;DEPARTAMENTO DE FARMACIA
JURACI ALVES DE LIMA;5.018,84;AUXILIAR DE ENFERMAGEM;C;;HOSPITAL UNIVERSITARIO ONOFRE LOPES
JUSCELINO BARROS DA SILVA;3.618,91;SERVENTE DE LIMPEZA;A;;HOSPITAL UNIVERSITARIO ONOFRE LOPES
JULIO CESAR DE MEDEIROS DANTAS;0,00;;;;
JULIO CESAR DE MEDEIROS MEIRA;8.306,11;ADMINISTRADOR;E;;DIRETORIA DE MATERIAL E PATRIMONIO
JULITA DE CAMPOS PIPOLO HOLANDA;9.811,33;PROFESSOR DO MAGISTERIO SUPERIOR;6;602;DEPARTAMENTO DE ODONTOLOGIA
JULIETH DE OLIVEIRA SOUSA;3.151,00;ASSISTENTE DE LABORATORIO;C;;DEPARTAMENTO DE NUTRICAO
JULIO CESAR ALFREDO DA CRUZ;2.708,38;AUX EM ADMINISTRACAO;C;;PRO-REITORIA DE GESTAO DE PESSOAS
JUREMA LOPES DE OLIVEIRA;6.092,70;ASSISTENTE EM ADMINISTRACAO;D;;DEPARTAMENTO DE FARMACIA
JULIE IDALIA ARAUJO MACEDO;7.694,25;TECNICO EM ASSUNTOS EDUCACIONAIS;E;;ESCOLA DE CIENCIAS E TECNOLOGIA - UAECT
JULIO CESAR PAULINO DE MELO;9.570,41;PROFESSOR DO MAGISTERIO SUPERIOR;4;601;INSTITUTO METROPOLE DIGITAL
JULIO FRANCISCO DANTAS DE REZENDE;11.308,31;PROFESSOR DO MAGISTERIO SUPERIOR;6;602;DEPARTAMENTO DE ENGENHARIA DE PRODUCAO
JULYANA VILAR DE FRANCA MANGUINHO;7.694,25;PEDAGOGO-AREA;E;;INSTITUTO METROPOLE DIGITAL
JULLIANE TAMARA ARAUJO DE MELO CAMPOS;11.862,64;PROFESSOR DO MAGISTERIO SUPERIOR;6;602;FACULDADE DE CIENCIAS DA SAUDE DO TRAIRI
JULYHERME SOARES FERNANDES;4.303,07;ASSISTENTE EM ADMINISTRACAO;D;;DIRETORIA DE MATERIAL E PATRIMONIO
JULIO MANOEL DA SILVA;3.906,70;BOMBEIRO HIDRAULICO;B;;HOSPITAL MATERNIDADE ANA BEZERRA
JULIO CESAR VIEIRA DE SOUSA;4.976,23;PROFESSOR DO MAGISTERIO SUPERIOR;5;501;DEPARTAMENTO DE MEDICINA INTEGRADA
JULIO CEZAR DE OLIVEIRA FREITAS;13.263,23;PROFESSOR DO MAGISTERIO SUPERIOR;6;604;INSTITUTO DE QUIMICA
JULIO CESAR DE ANDRADE NETO;25.282,93;PROFESSOR DO MAGISTERIO SUPERIOR;7;702;ESCOLA AGRICOLA DE JUNDIAI - UAECA
JULIO CESAR TAVARES DE LUCENA;-1000;PROFESSOR MAGISTERIO SUPERIOR-SUBSTITUTO;4;501;DEPARTAMENTO DE ENGENHARIA CIVIL
JULIO DE SOUZA TAVARES JUNIOR;7.282,95;ASSISTENTE EM ADMINISTRACAO;D;;DIRETORIA DE MATERIAL E PATRIMONIO
JULIO CESAR BARBOSA XAVIER;3.946,17;TECNICO EM ENFERMAGEM;D;;HOSPITAL UNIVERSITARIO ONOFRE LOPES
JURANDIR VITAL DOS SANTOS;7.015,68;DESENHISTA-PROJETISTA;D;;ESCOLA AGRICOLA DE JUNDIAI - UAECA
KALYANE DA SILVA FERREIRA;;;;;
KALINE SAMPAIO DE ARAUJO;11.030,04;REVISOR DE TEXTOS;E;;SECRETARIA DE EDUCAÇAO A DISTANCIA
KADMA LANUBIA DA SILVA MAIA;9.214,02;SECRETARIO EXECUTIVO;E;;GABINETE DO REITOR
KAREN AGUIAR BEZERRA;6.580,61;ECONOMISTA;E;;PRO-REITORIA DE PESQUISA
JUSSARA KEILLA BATISTA DO NASCIMENTO ALMEIDA;0,00;PROFESSOR MAGISTERIO SUPERIOR-TEMPORARIO;4;501;DEPARTAMENTO DE SERVICO SOCIAL
JUSSIER DO NASCIMENTO SOUZA;4.120,69;ASSISTENTE EM ADMINISTRACAO;D;;DEPARTAMENTO DE HISTORIA-CERES
JUVENAL RODRIGUES BARBOSA;3.621,54;AUXILIAR DE LABORATORIO;B;;NUCLEO DE PESQ EM ALIMENT E MEDICAMENTOS
JUSSARA MARIA CORREIA AQUINO TAVARES;9.175,56;ENFERMEIRO-AREA;E;;HOSPITAL UNIVERSITARIO ONOFRE LOPES
KALINE MELO DE SOUTO VIANA;14.161,40;PROFESSOR DO MAGISTERIO SUPERIOR;6;604;ESCOLA DE CIENCIAS E TECNOLOGIA - UAECT
KALINE DANTAS MAGALHAES;2.636,21;PROFESSOR MAGISTERIO SUPERIOR-SUBSTITUTO;4;501;DEPARTAMENTO DE MORFOLOGIA
KALIENY DE LIMA MORENO;4.157,95;ASSISTENTE EM ADMINISTRACAO;D;;ADMINISTRACAO DO CCS
KAMYLA ALVARES PINTO;4.180,66;EDITOR DE PUBLICACOES;E;;EDITORA UNIVERSITARIA
JUSSARA APARECIDA DE MELO GONDIM FERREIRA;8.152,28;TECNICO DE LABORATORIO AREA;D;;INSTITUTO DE QUIMICA
KALLINE BEZERRA DA SILVA;7.380,95;BIBLIOTECARIO-DOCUMENTALISTA;E;;BIBLIOTECA CENTRAL ZILA MAMEDE
KALIANO MARCIO DE QUEIROZ COSTA;;;;;
KALYNE MEDEIROS LACERDA;2.408,08;PROFESSOR DO MAGISTERIO SUPERIOR;4;401;DEPARTAMENTO DE PEDIATRIA
KAREN BEATRIZ PIRES GURGEL;;;;;
KALINE RIBEIRO DE SOUSA GALVAO ARAUJO;;;;;
KARENINE CARLA SANTOS DE OLIVEIRA;2.729,66;AUX EM ADMINISTRACAO;C;;DIRETORIA DE DESENVOLVIMENTO DE PESSOAS
JUSSARA AZEVEDO BEZERRA DA NOBREGA;12.057,12;ENFERMEIRO-AREA;E;;MATERNIDADE ESCOLA JANUARIO CICCO
KALINA VERUSKA DA SILVA BEZERRA MASSET;2.636,21;PROFESSOR MAGISTERIO SUPERIOR-SUBSTITUTO;4;501;DEPARTAMENTO DE EDUCACAO FISICA
JUSSARA MARIA MEDEIROS CAMARA;4.753,51;ASSISTENTE EM ADMINISTRACAO;D;;PRO-REITORIA DE GRADUACAO
KALLIL MONTEIRO FERNANDES;;;;;
JUVENAL HILARIO DO NASCIMENTO JUNIOR;2.962,82;TECNICO DE LABORATORIO AREA;D;;SUPERINTENDENCIA DE INFRA-ESTRUTURA
JUSSUER JOSE SOARES BALBINO;4.081,68;ASSISTENTE EM ADMINISTRACAO;D;;DEPARTAMENTO DE GEOGRAFIA
JUSSIER LOURENCO DA SILVA;5.461,16;ASSISTENTE EM ADMINISTRACAO;D;;ADMINISTRACAO DO CB
KAISA THOMAZ CAVALCANTE E SILVA;;;;;
JUVANEIDE REGIA AZEVEDO COSTA;14.774,97;PSICOLOGO-AREA;E;;SERVICO DE PSICOLOGIA APLICADA
KAMILA GENTIL DE ARAUJO;2.946,72;ASSISTENTE DE ALUNO;C;;ESCOLA AGRICOLA DE JUNDIAI - UAECA
KAREN MARIA DA COSTA MATTOS;15.413,91;PROFESSOR DO MAGISTERIO SUPERIOR;7;701;ESCOLA AGRICOLA DE JUNDIAI - UAECA
KARINA SAMPAIO CAVALCANTI RODIGUES;;;;;
KARINA FAUSTINO DE CARVALHO TETEO;;;;;
KARINA DE SOUSA SANTOS ALMEIDA;7.180,16;ASSISTENTE SOCIAL;E;;DIRETORIA DE ATENCAO A SAUDE DO SERVIDOR
KARILENE ROCHINK COSTA;4.451,21;DESENHISTA-PROJETISTA;D;;SUPERINTENDENCIA DE INFRA-ESTRUTURA
KARINA CARDOSO MEIRA;9.768,47;PROFESSOR ENS BASICO TECN TECNOLOGICO;D;301;ESCOLA DE SAUDE DA UFRN
KARENINE DE OLIVEIRA PORPINO;17.130,74;PROFESSOR DO MAGISTERIO SUPERIOR;7;704;DEPARTAMENTO DE ARTES
KARINE CAVALCANTI MAURICIO DE SENA EVANGELISTA;12.766,62;PROFESSOR DO MAGISTERIO SUPERIOR;6;604;DEPARTAMENTO DE NUTRICAO
KARINA RIBEIRO;16.312,08;PROFESSOR ENS BASICO TECN TECNOLOGICO;D;401;ESCOLA AGRICOLA DE JUNDIAI - UAECA
KARINNA VERISSIMO MEIRA TAVEIRA;11.709,64;PROFESSOR DO MAGISTERIO SUPERIOR;6;603;DEPARTAMENTO DE MORFOLOGIA
KARENINE MARINHO DOS SANTOS VERISSIMO;3.992,25;ASSISTENTE DE LABORATORIO;C;;DEPTO DE BIOLOGIA CELULAR E GENETICA
KARLA MATOS DE FARIAS;4.157,95;ASSISTENTE EM ADMINISTRACAO;D;;DEPARTAMENTO DE SERVICO SOCIAL
KARILANY DANTAS COUTINHO;12.206,48;PROFESSOR DO MAGISTERIO SUPERIOR;6;602;DEPARTAMENTO DE ENGENHARIA BIOMEDICA
KARLA DA SILVA QUEIROZ;6.311,31;ASSISTENTE SOCIAL;E;;DIRETORIA DE DESENVOLVIMENTO DE PESSOAS
KARINA CARLA DE PAULA MEDEIROS;12.697,76;PROFESSOR DO MAGISTERIO SUPERIOR;6;604;DEPARTAMENTO DE MORFOLOGIA
KARINA PATRICIA VIEIRA DA CUNHA;12.132,29;PROFESSOR DO MAGISTERIO SUPERIOR;6;604;DEPARTAMENTO DE ENGENHARIA CIVIL
KARLA SIMONE MACEDO FONSECA;4.843,36;AUXILIAR DE ENFERMAGEM;C;;HOSPITAL UNIVERSITARIO ONOFRE LOPES
KARLA SUZANNE FLORENTINO DA SILVA CHAVES DAMASCENO;16.202,89;PROFESSOR DO MAGISTERIO SUPERIOR;7;701;DEPARTAMENTO DE NUTRICAO
KARINA MARQUES VERMEULEN;0,00;PROFESSOR MAGISTERIO SUPERIOR-TEMPORARIO;4;401;DEPARTAMENTO DE NUTRICAO
KARIME ANDRADE MESCOUTO;-1000;PROFESSOR MAGISTERIO SUPERIOR-TEMPORARIO;4;401;FACULDADE DE CIENCIAS DA SAUDE DO TRAIRI
KARITA GOMES BEZERRA DOS SANTOS;7.511,93;ASSISTENTE EM ADMINISTRACAO;D;;PRO-REITORIA DE PESQUISA
KARLA SUSANNA CORREIA CAVALCANTI DE ALBUQUERQUE;3.005,21;PROFESSOR DO MAGISTERIO SUPERIOR;5;502;DEPARTAMENTO DE ENGENHARIA CIVIL
KARLA DANIELLY DA SILVA RIBEIRO RODRIGUES;11.634,35;PROFESSOR DO MAGISTERIO SUPERIOR;6;601;DEPARTAMENTO DE NUTRICAO
KARLA FALCAO DOS SANTOS;;;;;
KARLA MENDONCA GONCALVES DE JESUS;;;;;
KARLA GEANE DE OLIVEIRA;5.770,68;TECNICO EM ASSUNTOS EDUCACIONAIS;E;;ADMINISTRACAO DO CCHLA
KARLA PATRICIA CARDOSO AMORIM;12.132,29;PROFESSOR DO MAGISTERIO SUPERIOR;6;604;DEPARTAMENTO DE MEDICINA CLINICA
KARLA CRISTINA BARBOSA;8.612,37;ENFERMEIRO-AREA;E;;HOSPITAL UNIVERSITARIO ONOFRE LOPES
KARLA MORGANNA PEREIRA PINTO DE MENDONCA;16.654,73;PROFESSOR DO MAGISTERIO SUPERIOR;7;702;DEPARTAMENTO DE FISIOTERAPIA
KARLA DANIELLE BARBOSA DANTAS ROCHA;5.071,84;ADMINISTRADOR;E;;INSTITUTO DO CEREBRO
KARLA CRISTINA TAVARES COSTA;5.452,89;TECNICO EM ELETROTECNICA;D;;DEPARTAMENTO DE ENGENHARIA ELETRICA
KATIA VERONICA CAVALCANTI SEABRA;12.816,84;ENFERMEIRO-AREA;E;;HOSPITAL UNIVERSITARIO ONOFRE LOPES
KARYNE DIAS COUTINHO;12.132,29;PROFESSOR DO MAGISTERIO SUPERIOR;6;604;DEPTO DE PRAT EDUCACIONAIS E CURRICULO
KATIUSCIA BORGES DOS SANTOS;4.663,65;TEC EM NUTRICAO E DIETETICA;D;;MATERNIDADE ESCOLA JANUARIO CICCO
KATIA CRISTINA ARAUJO NASCIMENTO DE OLIVEIRA;23.852,83;PROFESSOR DO MAGISTERIO SUPERIOR;5;501;HOSPITAL MATERNIDADE ANA BEZERRA
KAROLINE FERNANDES PINTO LOPES;3.259,10;ASSISTENTE EM ADMINISTRACAO;D;;ADMINISTRACAO DO CCHLA
KARYLANE RAYSSA DE OLIVEIRA PESSOA ARAUJO;2.625,83;AUXILIAR DE ENFERMAGEM;C;;DIRETORIA DE ATENCAO A SAUDE DO SERVIDOR
KARLA VANESSA RODRIGUES SOARES MENEZES;8.306,11;FISIOTERAPEUTA;E;;HOSPITAL UNIVERSITARIO ONOFRE LOPES
KATIENE SYMONE DE BRITO PESSOA DA SILVA;9.768,47;PROFESSOR DO MAGISTERIO SUPERIOR;4;602;DEPARTAMENTO DE LETRAS CERES
KATHIA MARIA FONSECA DE BRITO;10.281,63;PROFESSOR DO MAGISTERIO SUPERIOR;8;801;DEPARTAMENTO DE ODONTOLOGIA
KATIA CASTANHO SCORTECCI;18.161,20;PROFESSOR DO MAGISTERIO SUPERIOR;7;703;DEPARTAMENTO DE BIOQUIMICA
KATIA MARIA BEZERRA DA SILVA;16.850,94;NUTRICIONISTA-HABILITACAO;E;;DIRETORIA DO RESTAURANTE UNIVERSITARIO
KATIA REGINA GOMES DE OLIVEIRA;12.910,72;ECONOMISTA;E;;DEPARTAMENTO DE ENGENHARIA ELETRICA
KATIA SUZANA DE OLIVEIRA MACHADO;10.180,56;TECNICO EM ENFERMAGEM;D;;HOSPITAL UNIVERSITARIO ONOFRE LOPES
KATIA REJANE DA SILVA;7.380,95;BIBLIOTECARIO-DOCUMENTALISTA;E;;ADMINISTRACAO DO CB
KATIA MESSIA VIEIRA DA SILVA;9.053,07;AUXILIAR DE ENFERMAGEM;C;;HOSPITAL UNIVERSITARIO ONOFRE LOPES
KATHYLEEN BEZERRA;7.089,19;TECNICO DE LABORATORIO AREA;D;;HOSPITAL UNIVERSITARIO ONOFRE LOPES
KAROLINE LINS CAMARA MARINHO DE SOUZA;7.994,01;PROFESSOR DO MAGISTERIO SUPERIOR;6;601;DEPARTAMENTO DE DIREITO PUBLICO
KATIANE LIMA DE OLIVEIRA;3.998,03;TECNICO DE LABORATORIO AREA;D;;DEPARTAMENTO DE COMUNICACAO SOCIAL
KATIE MORAES DE ALMONDES;12.132,29;PROFESSOR DO MAGISTERIO SUPERIOR;6;604;DEPARTAMENTO DE PSICOLOGIA
KARLIANE MEDEIROS OVIDIO VALE;7.994,01;PROFESSOR DO MAGISTERIO SUPERIOR;6;601;DEPT DE COMPUTACAO E TECNOLOGIA-CERES
KARLLYAMMO LENNON DE SOUZA;3.359,89;PROFESSOR MAGISTERIO SUPERIOR-SUBSTITUTO;4;401;DEPARTAMENTO DE ENGENHARIA MECANICA
KASSIO MICHELL GOMES DE LIMA;13.263,23;PROFESSOR DO MAGISTERIO SUPERIOR;6;604;INSTITUTO DE QUIMICA
KATIA REGINA BARROS RIBEIRO;14.878,66;PROFESSOR DO MAGISTERIO SUPERIOR;6;601;DEPARTAMENTO DE ENFERMAGEM
KATIA NICOLAU MATSUI;12.697,76;PROFESSOR DO MAGISTERIO SUPERIOR;6;604;DEPARTAMENTO DE ENGENHARIA QUIMICA
KARYNA MYRELLY OLIVEIRA BEZERRA DE FIGUEIREDO RIBEIRO;10.015,06;PROFESSOR DO MAGISTERIO SUPERIOR;4;601;DEPARTAMENTO DE FISIOTERAPIA
KATARINE FURTADO CAVALCANTI MANSUR;6.316,13;TECNICO DE LABORATORIO AREA;D;;HOSPITAL UNIVERSITARIO ONOFRE LOPES
KATIA AILY FRANCO DE CAMARGO;16.751,39;PROFESSOR DO MAGISTERIO SUPERIOR;7;702;DEPTO DE LING E LITER ESTRANG MODERNAS
KAROLINE QUEIROZ MARTINS ALMEIDA DE ARAUJO;12.319,88;ENFERMEIRO-AREA;E;;HOSPITAL UNIVERSITARIO ONOFRE LOPES
KATIANE GELLY DANTAS ASSIS DE SOUZA;0,00;PROFESSOR MAGISTERIO SUPERIOR-SUBSTITUTO;4;501;DEPTO DE CIENCIAS SOCIAIS E HUMANAS
KARYNA DE MELO MENEZES;-1000;PROFESSOR MAGISTERIO SUPERIOR-TEMPORARIO;4;501;DEPARTAMENTO DE ODONTOLOGIA
KELLEN MICHELINE ALVES HENRIQUE COSTA;16.517,44;MEDICO-AREA;E;;HOSPITAL UNIVERSITARIO ONOFRE LOPES
KEITH HELLEN DIAS DA SILVA LIRA;7.103,91;NUTRICIONISTA-HABILITACAO;E;;COLEGIO DE APLICACAO - NEI
KAYNARA ALVES DA SILVA MIRANDA;3.058,70;AUX EM ADMINISTRACAO;C;;DIRETORIA DE ATENCAO A SAUDE DO SERVIDOR
KERGINALDO JOSE DE AMORIM;7.339,11;VIGILANTE;D;;DIVISAO DE SEGURANCA PATRIMONIAL
KEILA BARRETO DE ARAUJO;6.341,71;PROFESSOR ENS BASICO TECN TECNOLOGICO;D;301;COLEGIO DE APLICACAO - NEI
KESSYA DANTAS DINIZ;13.203,54;PROFESSOR DO MAGISTERIO SUPERIOR;5;502;DEPARTAMENTO DE ENFERMAGEM
KELVIN DIOGO DANTAS DE SOUZA;;;;;
KEYLA BORGES FERREIRA ROCHA;13.650,19;PROFESSOR DO MAGISTERIO SUPERIOR;5;502;DEPARTAMENTO DE PATOLOGIA
KELLY SAMARA DE LIRA MOTA;3.305,07;PROFESSOR DO MAGISTERIO SUPERIOR;4;601;ESCOLA MULTICAMPI DE CIENCIAS MEDICAS
KESIA KARINA DE OLIVEIRA SOUTO SILVA;13.308,15;PROFESSOR DO MAGISTERIO SUPERIOR;6;602;DEPARTAMENTO DE ENGENHARIA TEXTIL
KAYO GONCALVES E SILVA;9.768,47;PROFESSOR ENS BASICO TECN TECNOLOGICO;D;102;INSTITUTO METROPOLE DIGITAL
KESSIA LARISSA DE MEDEIROS QUIRINO;;MEDICO-AREA;E;;FACULDADE DE CIENCIAS DA SAUDE DO TRAIRI
KERSTIN ERIKA SCHMIDT;22.415,37;PROFESSOR DO MAGISTERIO SUPERIOR;8;801;INSTITUTO DO CEREBRO
KEROLAYNNE FONSECA DE LIMA;;;;;
KENIO COSTA DE LIMA;18.237,48;PROFESSOR DO MAGISTERIO SUPERIOR;7;704;DEPARTAMENTO DE ODONTOLOGIA
KELLY VIRGINIA FREIRE DE OLIVEIRA;3.847,96;ASSISTENTE EM ADMINISTRACAO;D;;ADMINISTRACAO DO CENTRO DE EDUCACAO
KEILA JULIANA CARVALHO FERNANDES DE ANDRADE;;;;;
KESIA CRISTINE MELO;7.103,91;PSICOLOGO-AREA;E;;ADMINISTRACAO DO CCSA
KEITY MARA FERREIRA DE SOUZA E SABOYA;3.821,54;PROFESSOR DO MAGISTERIO SUPERIOR;6;602;DEPARTAMENTO DE DIREITO PUBLICO
KERCIA MONALINE DE SOUZA JOVENTINO;;;;;
KATYA ANAYA JACINTO;11.634,35;PROFESSOR DO MAGISTERIO SUPERIOR;6;601;FACULDADE DE CIENCIAS DA SAUDE DO TRAIRI
KELLEN CARLA LIMA;11.709,64;PROFESSOR DO MAGISTERIO SUPERIOR;6;603;ESCOLA DE CIENCIAS E TECNOLOGIA - UAECT
KERLEI ENIELE SONAGLIO;15.413,91;PROFESSOR DO MAGISTERIO SUPERIOR;7;701;DEPARTAMENTO DE TURISMO
KELSIANE DE MEDEIROS LIMA;8.885,19;PROFESSOR DO MAGISTERIO SUPERIOR;6;601;DEPTO DE CIENCIAS SOCIAIS E HUMANAS
KEILA DARLINE SOUZA PEREIRA;3.707,09;TECNICO DE LABORATORIO AREA;D;;SUPERINTENDENCIA DE INFRA-ESTRUTURA
KERGINALDO SOUZA E SILVA;7.328,70;MESTRE DE EDIF E INFRAESTRUTURA;D;;SUPERINTENDENCIA DE INFRA-ESTRUTURA
KEIVILANY JANIELLE DE LIMA COELHO;4.660,83;ASSISTENTE EM ADMINISTRACAO;D;;DEPARTAMENTO DE COMUNICACAO SOCIAL
KENIA BEATRIZ FERREIRA MAIA;17.454,12;PROFESSOR DO MAGISTERIO SUPERIOR;7;703;DEPARTAMENTO DE COMUNICACAO SOCIAL
KEILA CRISTIANE DIGIGOW;2.129,80;PROF ENS BAS TEC TECNOLOGICO-SUBSTITUTO;D;101;ESCOLA DE MUSICA - UAEM
KELLY CHRISTINA DA SILVA MATOS;-1000;PROFESSOR MAGISTERIO SUPERIOR-SUBSTITUTO;4;401;DEPARTAMENTO DE ESTATISTICA
KLAYDSON REINALDO CELINO;0,00;PROFESSOR MAGISTERIO SUPERIOR-SUBSTITUTO;4;601;DEPTO DE FISICA TEORICA E EXPERIMENTAL
KLEBER GIOVANNI LUZ;8.537,37;PROFESSOR DO MAGISTERIO SUPERIOR;7;702;DEPARTAMENTO DE INFECTOLOGIA
KLEIBER LIMA DE BESSA;12.132,29;PROFESSOR DO MAGISTERIO SUPERIOR;6;604;DEPARTAMENTO DE ENGENHARIA MECANICA
KILDER CESAR DE ARAUJO RIBEIRO;12.206,48;PROFESSOR DO MAGISTERIO SUPERIOR;6;602;DEPARTAMENTO DE ARTES
LADY CLARISSA BRITO DA ROCHA BEZERRA;1.957,57;TECNICO DE LABORATORIO AREA;D;;DEPARTAMENTO DE FISIOLOGIA
KIONARA SARABELLA TURIBIO E SILVA;4.986,95;TECNICO DE LABORATORIO AREA;D;;DEPARTAMENTO DE ECOLOGIA
KISNA YASMIN ANDRADE ALVES;7.031,31;PROFESSOR ENS BASICO TECN TECNOLOGICO;D;101;ESCOLA DE SAUDE DA UFRN
LAECIO CUNHA DE SOUZA;21.099,21;PROFESSOR DO MAGISTERIO SUPERIOR;8;801;DEPARTAMENTO DE GEOLOGIA
KURIOS IURI PINHEIRO DE MELO QUEIROZ;12.269,51;PROFESSOR DO MAGISTERIO SUPERIOR;6;604;DEPARTAMENTO DE ENGENHARIA ELETRICA
KLEYTON CESAR DE LIMA MORAIS;;;;;
LAHELYA CARLA DE ANDRADE OLIVEIRA;;;;;
KLEISON JOSE MEDEIROS LEOPOLDINO;5.181,45;TECNICO DE LABORATORIO AREA;D;;FACULDADE DE CIENCIAS DA SAUDE DO TRAIRI
LAELSON DE OLIVEIRA FREIRE;8.536,99;ASSISTENTE EM ADMINISTRACAO;D;;GABINETE DO REITOR
KLEBER LUIZ DA FONSECA AZEVEDO;2.408,08;PROFESSOR DO MAGISTERIO SUPERIOR;4;401;ESCOLA MULTICAMPI DE CIENCIAS MEDICAS
LAIANE SANTOS EUFRASIO;2.838,08;PROFESSOR MAGISTERIO SUPERIOR-TEMPORARIO;4;501;FACULDADE DE CIENCIAS DA SAUDE DO TRAIRI
KLEBER MACIEL DE FARIAS;6.966,96;VIGILANTE;D;;DIVISAO DE SEGURANCA PATRIMONIAL
KILZA FERNANDA MOREIRA DE VIVEIROS;11.250,16;PROFESSOR DO MAGISTERIO SUPERIOR;6;601;
KLAYTON GALANTE SOUSA;10.015,06;PROFESSOR DO MAGISTERIO SUPERIOR;4;601;FACULDADE DE CIENCIAS DA SAUDE DO TRAIRI
KTARINA DANTAS DE MOURA NOBRE;7.380,95;FARMACEUTICO-HABILITACAO;E;;NUCLEO DE PESQ EM ALIMENT E MEDICAMENTOS
KLEBER NOBRE DA CUNHA;12.344,00;PROFESSOR DO MAGISTERIO SUPERIOR;4;401;DEPARTAMENTO DE MEDICINA INTEGRADA
KIVIA PEREIRA DE MEDEIROS FARIA;9.570,41;PROFESSOR ENS BASICO TECN TECNOLOGICO;D;101;COLEGIO DE APLICACAO - NEI
LAERCIO MARTINS DE MENDONCA;20.955,15;PROFESSOR DO MAGISTERIO SUPERIOR;8;801;DEPTO DE ENGENHARIA DE COMUNICACOES
KLEBER DANTAS DE ARAUJO;4.147,94;TECNICO DE LABORATORIO AREA;D;;FACULDADE DE CIENCIAS DA SAUDE DO TRAIRI
KILZA TORRES FASANARO BARROS;4.580,15;ASSISTENTE EM ADMINISTRACAO;D;;DEPARTAMENTO DE MEDICINA INTEGRADA
KLEYTON THIAGO COSTA DE CARVALHO;5.694,75;FARMACEUTICO;E;;DEPTO DE ANALISES CLINIC E TOXICOLOGICAS
LAERTE ADLER RIBEIRO DE LIMA;3.061,65;AUX EM ADMINISTRACAO;C;;DEPARTAMENTO DE CIENCIA DA INFORMACAO
KLINGER ANTONIO DA FRANCA RODRIGUES;3.305,07;PROFESSOR MAGISTERIO SUPERIOR-SUBSTITUTO;4;601;DEPTO DE BIOFISICA E FARMACOLOGIA
KIVHIA MARIA SANTOS DA CRUZ;4.487,95;ASSISTENTE EM ADMINISTRACAO;D;;DIRETORIA DE ADMINISTRACAO DE PESSOAL
KLEBER CAVALCANTE DE SOUSA;8.306,11;ADMINISTRADOR;E;;PRO-REITORIA DE PESQUISA
KIVYSON NUNES DOS SANTOS;2.768,02;PROFESSOR MAGISTERIO SUPERIOR-TEMPORARIO;4;501;DEPARTAMENTO DE POLITICAS PUBLICAS
LAISE PEREIRA ARCOVERDE FECHINE BRITO;;;;;
LARISSA CRISTIANE DE OLIVEIRA SOUZA;;;;;
LANA JEORGIA ALVES MOISES DANTAS;3.566,08;TECNICO EM ENFERMAGEM;D;;MATERNIDADE ESCOLA JANUARIO CICCO
LARISSA GRACE NOGUEIRA SERAFIM DE MELO;10.217,56;PROFESSOR DO MAGISTERIO SUPERIOR;4;602;FACULDADE DE CIENCIAS DA SAUDE DO TRAIRI
LARISSA KALINE SANTANA DINIZ;;;;;
LAIS GUARALDO;9.570,41;PROFESSOR DO MAGISTERIO SUPERIOR;4;602;DEPARTAMENTO DE ARTES
LAIZE GABRIELE DE CASTRO SILVA;;;;;
LAIS DOS REIS SOUZA LEITE;;;;;
LARA GONCALVES FERNANDES;;;;;
LARISSA DE LIMA FERREIRA;;;;;
LANNUZYA VERISSIMO E OLIVEIRA;10.217,56;PROFESSOR ENS BASICO TECN TECNOLOGICO;D;102;ESCOLA DE SAUDE DA UFRN
LARISSA CAROLINE SARAIVA FERREIRA;4.008,68;PROFESSOR MAGISTERIO SUPERIOR-SUBSTITUTO;4;501;DEPARTAMENTO DE ENGENHARIA CIVIL
LAISE DIANA DOS SANTOS BRANDAO;3.179,41;ASSISTENTE DE LABORATORIO;C;;DEPTO DE MICROBIOLOGIA E PARASITOLOGIA
LAISA THAISE DE OLIVEIRA BATISTA;;;;;
LANISSA CRISTINA FERNANDES DE MEDEIROS CARVALHO;7.127,47;ASSISTENTE SOCIAL;E;;PRO-REITORIA DE ASSUNTOS ESTUDANTIS
LARISSA GOMES DA SILVA;8.580,81;FISIOTERAPEUTA;E;;HOSPITAL UNIVERSITARIO ONOFRE LOPES
LAIS IZABEL MAIA MELO CRISANTO;2.408,08;PROFESSOR DO MAGISTERIO SUPERIOR;4;401;DEPARTAMENTO DE MEDICINA CLINICA
LAISE KELLEY LEMOS BARBOSA;7.178,00;PROFESSOR DO MAGISTERIO SUPERIOR;5;501;DEPARTAMENTO DE ENGENHARIA CIVIL
LARISSA BASTOS TAVARES;8.526,87;PROFESSOR DO MAGISTERIO SUPERIOR;5;501;DEPARTAMENTO DE FISIOTERAPIA
LARALIS NUNES DE SOUSA OLIVEIRA;7.484,83;PROFESSOR DO MAGISTERIO SUPERIOR;4;501;DEPARTAMENTO DE LETRAS
LARA DE MELO BARBOSA ANDRADE;18.137,66;PROFESSOR DO MAGISTERIO SUPERIOR;7;704;DEPTO DE CIENCIAS ATMOSFERICAS E CLIMATI
LAISIA MARIA SILVA DE SOUZA;7.015,68;ASSISTENTE EM ADMINISTRACAO;D;;DIRETORIA DE ATENCAO A SAUDE DO SERVIDOR
LANE IRIS DE MELLO NOBREGA;5.445,09;ASSISTENTE EM ADMINISTRACAO;D;;SUPERINTENDENCIA DE INFRA-ESTRUTURA
LARISSA KELLY DE OLIVEIRA MARQUES;16.306,98;PROFESSOR DO MAGISTERIO SUPERIOR;7;702;DEPARTAMENTO DE ARTES
LANA PATRICIA CAVALCANTI SORIANO DE SOUZA;7.910,45;MEDICO-AREA;E;;MATERNIDADE ESCOLA JANUARIO CICCO
LARISSA BASTOS PIMENTEL;2.408,08;PROFESSOR DO MAGISTERIO SUPERIOR;4;401;DEPARTAMENTO DE MEDICINA CLINICA
LAISE TEREZA SILVEIRA DIAS;9.352,00;ASSISTENTE EM ADMINISTRACAO;D;;ADMINISTRACAO DO CENTRO DE EDUCACAO
LAMONIARA MENDES QUERINO;5.646,82;PEDAGOGO-AREA;E;;ADMINISTRACAO DO CERES EM CURRAIS NOVOS
LANNA MARIA CRUZ DE AZEVEDO;14.726,39;MEDICO-AREA;E;;MATERNIDADE ESCOLA JANUARIO CICCO
LARISSA AZEVEDO DUARTE MUNIZ;11.714,14;ENFERMEIRO-AREA;E;;HOSPITAL UNIVERSITARIO ONOFRE LOPES
LARISSA NUNES E ARAUJO;;;;;
LAVINIA UCHOA AZEVEDO DE ARAUJO;11.085,51;PROFESSOR DO MAGISTERIO SUPERIOR;6;601;DEPARTAMENTO DE SAUDE COLETIVA
LAURO PINHEIRO FILHO;8.744,55;ASSISTENTE EM ADMINISTRACAO;D;;ADMINISTRACAO DO CT
LEDA BEZERRA QUINDERE CARDOSO;19.196,55;PROFESSOR DO MAGISTERIO SUPERIOR;7;704;DEPARTAMENTO DE ODONTOLOGIA
LARISSE DE OLIVEIRA RODRIGUES;-1000;PROFESSOR DO MAGISTERIO SUPERIOR;4;601;DEPARTAMENTO DE SERVICO SOCIAL
LARISSA MONT ALVERNE JUCA SEABRA;12.338,37;PROFESSOR DO MAGISTERIO SUPERIOR;6;603;DEPARTAMENTO DE NUTRICAO
LAURA FERNANDES DELL ORTO;3.037,78;ASSISTENTE EM ADMINISTRACAO;D;;DEPARTAMENTO DE SAUDE COLETIVA
LAURA LAISE PEREIRA DA ROCHA;2.834,64;AUX DE VETERINARIA E ZOOTECNIA;C;;ADMINISTRACAO DO CB
LARISSA QUEIROZ DE ALBUQUERQUE CANARIO;;;;;
LAURIANA MEDEIROS COSTA SANTOS;11.862,64;PROFESSOR ENS BASICO TECN TECNOLOGICO;D;302;ESCOLA DE SAUDE DA UFRN
LAWRENCE CEZAR MEDEIROS ARAUJO DE MOURA;7.694,25;ENGENHEIRO-AREA;E;;PRO-REITORIA DE PESQUISA
LAURO KIRSCH JUNIOR;2.744,57;TEC DE TECNOLOGIA DA INFORMACAO;D;;ADMINISTRACAO DO CT
LAURA EMMANUELLA ALVES DOS SANTOS SANTANA DE OLIVEIRA;11.308,31;PROFESSOR DO MAGISTERIO SUPERIOR;6;602;ESCOLA AGRICOLA DE JUNDIAI - UAECA
LEANDRO DE MAGALHAES GAZINEO;15.413,91;PROFESSOR ENS BASICO TECN TECNOLOGICO;D;401;ESCOLA DE MUSICA - UAEM
LEANDSON ROBERTO FERNANDES DE LUCENA;12.132,29;PROFESSOR DO MAGISTERIO SUPERIOR;6;604;DEPARTAMENTO DE GEOFISICA
LAVINIA MABEL VIANA LOPES;;;;;
LAURO WANDERLEY MELLER;11.709,64;PROFESSOR DO MAGISTERIO SUPERIOR;6;603;ESCOLA DE CIENCIAS E TECNOLOGIA - UAECT
LEANDRO TRIGUEIRO FERNANDES;0,00;PROFESSOR MAGISTERIO SUPERIOR-SUBSTITUTO;4;501;DEPARTAMENTO DE CIENCIAS ADMINISTRATIVAS
LEANDRO JOSE PAULINO DE SOUSA;4.320,12;ASSISTENTE EM ADMINISTRACAO;D;;ESCOLA DE SAUDE DA UFRN
LAURA JESSYCA SANTIAGO DIAS;3.156,25;TEC DE TECNOLOGIA DA INFORMACAO;D;;SUPERINTENDENCIA DE INFORMATICA
LEANDRO MICHEL DO REGO LIMA;;;;;
LEANDRO DE SANTIS FERREIRA;10.015,06;PROFESSOR DO MAGISTERIO SUPERIOR;4;601;DEPARTAMENTO DE FARMACIA
LEANDRO IBIAPINA BEVILAQUA;11.709,64;PROFESSOR DO MAGISTERIO SUPERIOR;6;603;ESCOLA DE CIENCIAS E TECNOLOGIA - UAECT
LEANDRO DIAS BESERRA;4.180,66;ANALISTA DE TEC DA INFORMACAO;E;;SUPERINTENDENCIA DE INFORMATICA
LAURA MARIA DE FIGUEIREDO;6.724,29;PROFESSOR DO MAGISTERIO SUPERIOR;4;502;DEPARTAMENTO DE ARTES
LARISSA RAMALHO DANTAS VARELLA;4.008,68;PROFESSOR MAGISTERIO SUPERIOR-TEMPORARIO;4;501;FACULDADE DE CIENCIAS DA SAUDE DO TRAIRI
LAURITA RICARDO DE SALLES;13.030,46;PROFESSOR DO MAGISTERIO SUPERIOR;6;604;DEPARTAMENTO DE ARTES
LAYANE AZEVEDO DE MEDEIROS;;;;;
LAURO JEFERSON TARGINO DA SILVA;3.816,21;TECNICO EM RADIOLOGIA;D;;DEPARTAMENTO DE ODONTOLOGIA
LAURA TERESA CORREDOR BOHORQUEZ;9.570,41;PROFESSOR DO MAGISTERIO SUPERIOR;4;601;DEPTO DE FISICA TEORICA E EXPERIMENTAL
LEONARDO FERREIRA CAMILO;;;;;
LEONARDO DIEGO DA SILVA SILVEIRA;;;;;
LEILA JULIANE PINHEIRO DO NASCIMENTO;3.054,27;AUXILIAR DE ENFERMAGEM;C;;HOSPITAL UNIVERSITARIO ONOFRE LOPES
LEONARDO CARNEIRO VENTURA;4.171,74;ASSISTENTE EM ADMINISTRACAO;D;;ESCOLA DE MUSICA - UAEM
LENA KARINA ARAUJO SOARES;5.022,39;TECNICO DE LABORATORIO AREA;D;;HOSPITAL UNIVERSITARIO ONOFRE LOPES
LEONARDO CUNHA DE MIRANDA;11.709,64;PROFESSOR DO MAGISTERIO SUPERIOR;6;603;DEPTO DE INFORMATICA E MAT APLICADA
LEILIANNE MICHELLE TRINDADE DA SILVA BARRETO;12.565,04;PROFESSOR DO MAGISTERIO SUPERIOR;6;603;DEPARTAMENTO DE TURISMO
LENISE MACEDO DANTAS FARIAS;8.513,08;ASSISTENTE EM ADMINISTRACAO;D;;DIRETORIA DE ADMINISTRACAO DE PESSOAL
LEONARDO CESAR AMARO DA SILVA;2.636,21;PROFESSOR MAGISTERIO SUPERIOR-SUBSTITUTO;4;501;DEPARTAMENTO DE ODONTOLOGIA
LEONARDO CESAR TEONACIO BEZERRA;9.570,41;PROFESSOR DO MAGISTERIO SUPERIOR;4;601;INSTITUTO METROPOLE DIGITAL
LEILA MARIA DE JESUS DA SILVA;5.452,89;ASSISTENTE EM ADMINISTRACAO;D;;GABINETE DO REITOR
LEID JANE MODESTO DA SILVA;;;;;
LEONARDO CAPISTRANO FERREIRA;10.015,06;PROFESSOR DO MAGISTERIO SUPERIOR;4;601;DEPARTAMENTO DE BIOQUIMICA
LELIA BATISTA DE SOUZA;21.650,77;PROFESSOR DO MAGISTERIO SUPERIOR;8;801;DEPARTAMENTO DE ODONTOLOGIA
LEONARDO BERNARDO BEZERRA;4.636,43;PROFESSOR DO MAGISTERIO SUPERIOR;5;501;DEPARTAMENTO DE MEDICINA CLINICA
LEILANNE KELLY BORGES DE ALBUQUERQUE SANTOS;7.086,81;ENFERMEIRO-AREA;E;;HOSPITAL UNIVERSITARIO ONOFRE LOPES
LEONARDO DE MELO VERSIEUX;12.697,76;PROFESSOR DO MAGISTERIO SUPERIOR;6;604;DEPTO DE BOTANICA E ZOOLOGIA
LENISE DOS SANTOS SANTIAGO;10.726,03;SECRETARIO EXECUTIVO;E;;SECRETARIA DE RELACOES INTERNACIONAIS
LENICIA LIMA DE OLIVEIRA;11.563,19;TECNICO EM ENFERMAGEM;D;;HOSPITAL UNIVERSITARIO ONOFRE LOPES
LEONARDO EMILIANO BARBOSA;4.317,87;TECNICO EM AGROPECUARIA;D;;ESCOLA AGRICOLA DE JUNDIAI - UAECA
LEONARDO DE LIMA FERNANDES;6.846,47;TECNICO DE LABORATORIO AREA;D;;HOSPITAL UNIVERSITARIO ONOFRE LOPES
LELIA MARIA GUEDES QUEIROZ;20.608,34;PROFESSOR DO MAGISTERIO SUPERIOR;8;801;DEPARTAMENTO DE ODONTOLOGIA
LEONARDO DANTAS MUNIZ;6.081,19;FARMACEUTICO-HABILITACAO;E;;DEPARTAMENTO DE FARMACIA
LEILA ARAUJO GUILHERMINO;4.008,68;PROFESSOR MAGISTERIO SUPERIOR-SUBSTITUTO;4;501;DEPARTAMENTO DE ARQUITETURA
LEO GOUVEA MEDEIROS;12.132,29;PROFESSOR DO MAGISTERIO SUPERIOR;7;701;ESCOLA DE CIENCIAS E TECNOLOGIA - UAECT
LEILA MARIA ARAUJO VIDAL;11.624,35;ENFERMEIRO-AREA;E;;HOSPITAL UNIVERSITARIO ONOFRE LOPES
LEON KARLOS FERREIRA NUNES;3.061,65;AUX EM ADMINISTRACAO;C;;ADMINISTRACAO DO CCHLA
LENILTON SILVA DA SILVEIRA JUNIOR;4.409,55;PROFESSOR MAGISTERIO SUPERIOR-SUBSTITUTO;4;501;DEPTO DE ANALISES CLINIC E TOXICOLOGICAS
LEIS FERREIRA DE MATOS;5.109,02;ASSISTENTE EM ADMINISTRACAO;D;;SUPERINTENDENCIA DE INFRA-ESTRUTURA
LEONARDO FERNANDES VIEIRA BEZERRA DE FIGUEIREDO;2.446,96;OPERADOR DE CAMERA DE CINEMA E TV;D;;SUPERINTENDENCIA DE COMUN UNIVERSITARIA
LEONARDO RODRIGUES PINHEIRO;3.703,52;ASSISTENTE EM ADMINISTRACAO;D;;INSTITUTO DE MEDICINA TROPICAL DO RN
