name;money;post;class;level;org
EMANUELLE LOUYDE FERREIRA DE LIMA;;;;;
EMANUELLE PATRICIA ENRIQUE DA SILVA;3.703,52;TECNICO DE LABORATORIO AREA;D;;ESCOLA AGRICOLA DE JUNDIAI - UAECA
ELOISA HELENA FONSECA DANTAS;8.197,60;ASSISTENTE EM ADMINISTRACAO;D;;PRO-REITORIA DE PESQUISA
EMERSON BASILIO DOS SANTOS;6.930,41;VIGILANTE;D;;DIVISAO DE SEGURANCA PATRIMONIAL
EMMANUELLE DE OLIVEIRA FERREIRA;6.354,60;TECNICO EM ASSUNTOS EDUCACIONAIS;E;;PRO-REITORIA DE PLANEJ E COORD GERAL
ERANILSON DOS SANTOS MELO;4.095,37;ASSISTENTE EM ADMINISTRACAO;D;;ESCOLA AGRICOLA DE JUNDIAI - UAECA
ERIAMA DE ARAUJO HACKRADT;11.642,59;PROFESSOR ENS BASICO TECN TECNOLOGICO;D;401;CENTRO REG UNIVERSITARIO DE TREINAMENTO
EMERSON MOURA DE ALENCAR;2.129,80;PROFESSOR MAGISTERIO SUPERIOR-SUBSTITUTO;4;401;INSTITUTO METROPOLE DIGITAL
ERICK SHARLLS RAMOS DE PONTES;4.405,36;TEC DE TECNOLOGIA DA INFORMACAO;D;;ADMINISTRACAO DO CT
ENEAS ALBUQUERQUE SILVA;3.359,89;PROF ENS BAS TEC TECNOLOGICO-SUBSTITUTO;D;101;ESCOLA DE MUSICA - UAEM
ERICA LIRA DA SILVA FREITAS;9.364,71;FARMACEUTICO-HABILITACAO;E;;DEPARTAMENTO DE FARMACIA
ENIO CAMPOS AMICO;28.466,22;PROFESSOR DO MAGISTERIO SUPERIOR;7;701;DEPARTAMENTO DE MEDICINA INTEGRADA
ERICK WILSON PEREIRA;12.217,00;PROFESSOR DO MAGISTERIO SUPERIOR;6;604;DEPARTAMENTO DE DIREITO PRIVADO
ERICA CONCEICAO SILVA LIMA;8.792,18;DIRETOR DE PRODUCAO;E;;SUPERINTENDENCIA DE COMUN UNIVERSITARIA
ENGELS AVELINO SEMEDO CORREIA;;;;;
ENEIDA LAIS DE OLIVEIRA SOUSA;;;;;
ERICA RAYANE GALVAO DE FARIAS CAVALCANTE;2.625,83;AUXILIAR DE ENFERMAGEM;C;;DIRETORIA DE ATENCAO A SAUDE DO SERVIDOR
ENILSON MEDEIROS DOS SANTOS;20.587,87;PROFESSOR DO MAGISTERIO SUPERIOR;8;801;GABINETE DO REITOR
ENEIDE DA COSTA EUFRASIO;7.741,01;ASSISTENTE EM ADMINISTRACAO;D;;DIRETORIA DE ATENCAO A SAUDE DO SERVIDOR
EMERSON MOREIRA DE AGUIAR;17.830,64;PROFESSOR DO MAGISTERIO SUPERIOR;7;702;ESCOLA AGRICOLA DE JUNDIAI - UAECA
EPIFANIO SILVINO DO MONTE JUNIOR;9.008,55;;;;
EMILI ADAMI ROSSETTI;8.306,11;REVISOR DE TEXTOS;E;;SUPERINTENDENCIA DE COMUN UNIVERSITARIA
ERICA DE FREITAS MARTINS;;;;;
EMILIA MARCIA GOMES DE SOUZA E SILVA;2.636,21;PROFESSOR MAGISTERIO SUPERIOR-SUBSTITUTO;4;501;DEPARTAMENTO DE FISIOTERAPIA
ENILDO ALVES;32.842,13;PROFESSOR DO MAGISTERIO SUPERIOR;6;604;DEPARTAMENTO DE PESSOAL/INATIVOS CIVIS
EMIDIO ANTONIO DE ARAUJO NETO;2.408,08;PROFESSOR DO MAGISTERIO SUPERIOR;4;401;ESCOLA MULTICAMPI DE CIENCIAS MEDICAS
ENOLEIDE FARIAS;13.120,96;JORNALISTA;E;;SUPERINTENDENCIA DE COMUN UNIVERSITARIA
ERICA REVIGLIO ILIOVITZ;15.413,91;PROFESSOR DO MAGISTERIO SUPERIOR;7;702;DEPARTAMENTO DE LETRAS
ERICA SIMONY FERNANDES DE MELO GUERRA;7.967,90;BIBLIOTECARIO-DOCUMENTALISTA;E;;BIBLIOTECA CENTRAL ZILA MAMEDE
ERICA VERICIA CANUTO DE OLIVEIRA VERAS;3.199,66;PROFESSOR DO MAGISTERIO SUPERIOR;6;601;DEPARTAMENTO DE DIREITO PRIVADO
EMERSON FRANKLIN BEZERRA MEDEIROS;-1000;PROFESSOR MAGISTERIO SUPERIOR-TEMPORARIO;4;401;ESCOLA MULTICAMPI DE CIENCIAS MEDICAS
ERICA CRISTINA DE SALES VAZ;3.821,64;ASSISTENTE EM ADMINISTRACAO;D;;ADMINISTRACAO DO CB
EMILY GONZAGA DE ARAUJO;-1000;PROFESSOR MAGISTERIO SUPERIOR-SUBSTITUTO;4;501;DEPARTAMENTO DE COMUNICACAO SOCIAL
ENIO BARBOSA DE LIMA;3.205,51;SERVENTE DE LIMPEZA;A;;BIBLIOTECA CENTRAL ZILA MAMEDE
ERIKA DE LIMA CARNEIRO;;;;;
ERIVAN FERREIRA BORGES;14.600,82;PROFESSOR DO MAGISTERIO SUPERIOR;6;603;DEPARTAMENTO DE CIENCIAS CONTABEIS
ERIK LEANDRO LUCAS DE OLIVEIRA;3.037,78;ASSISTENTE EM ADMINISTRACAO;D;;SUPERINTENDENCIA DE COMUN UNIVERSITARIA
ERINEIDE SANTOS BARATEIRO DE SOUZA;13.999,38;FARMACEUTICO BIOQUIMICO;E;;DEPTO DE ANALISES CLINIC E TOXICOLOGICAS
ERIKA SIMONE GALVAO PINTO;11.862,64;PROFESSOR DO MAGISTERIO SUPERIOR;6;603;DEPARTAMENTO DE ENFERMAGEM
ERIKA BARIONI MANTELLO;9.570,41;PROFESSOR DO MAGISTERIO SUPERIOR;4;601;DEPARTAMENTO DE FONOAUDIOLOGIA
ERIVAN BEZERRA DA SILVA;4.591,89;OPERADOR DE MAQUINA COPIADORA;C;;COLEGIO DE APLICACAO - NEI
ERICKA CECILIA RESENDE DE SOUZA;10.922,75;ENFERMEIRO-AREA;E;;HOSPITAL UNIVERSITARIO ONOFRE LOPES
ERICKA LUANA GOMES DA COSTA CORTEZ;7.380,95;BIBLIOTECARIO-DOCUMENTALISTA;E;;ADMINISTRACAO DO CT
ERIKA LUZIA LOPES DA SILVA FERREIRA;7.380,95;ASSISTENTE SOCIAL;E;;PRO-REITORIA DE ASSUNTOS ESTUDANTIS
ERICO DE LIMA VALE;-1000;MEDICO-AREA;E;;MATERNIDADE ESCOLA JANUARIO CICCO
ERIDJA ROSIVANIA BEZERRA ESTEVAM;;;;;
ERICKA JANINE DANTAS DA SILVEIRA;12.697,76;PROFESSOR DO MAGISTERIO SUPERIOR;7;701;DEPARTAMENTO DE ODONTOLOGIA
ERIKA APARECIDA DE ARAUJO SOARES;;;;;
ERIK FERNANDO MILETTA MARTINS;9.570,41;PROFESSOR DO MAGISTERIO SUPERIOR;4;601;DEPARTAMENTO DE LETRAS
ERIKA PAULA SILVA FREITAS DE OLIVEIRA;4.477,79;TEC EM NUTRICAO E DIETETICA;D;;DEPARTAMENTO DE NUTRICAO
ERIVAN OLINTO DA SILVA;6.528,48;VIGILANTE;D;;DIVISAO DE SEGURANCA PATRIMONIAL
ERIKA DANIELLE VARELA CARDOZO;3.518,27;TECNICO EM ENFERMAGEM;D;;DEPARTAMENTO DE ODONTOLOGIA
ERIKA AZEVEDO CHAVES DA COSTA;3.707,09;ASSISTENTE EM ADMINISTRACAO;D;;SUPERINTENDENCIA DE INFRA-ESTRUTURA
ERIKA OLIVEIRA DE ALMEIDA;12.092,56;PROFESSOR DO MAGISTERIO SUPERIOR;4;602;DEPARTAMENTO DE ODONTOLOGIA
ERIVALDO DOS SANTOS FERREIRA;3.365,35;SERVENTE DE LIMPEZA;A;;ADMINISTRACAO DO CCSA
ERIDA MARIA DINIZ LEITE;12.777,19;ENFERMEIRO-AREA;E;;HOSPITAL UNIVERSITARIO ONOFRE LOPES
ERICKINSON BEZERRA DE LIMA;4.008,68;PROF ENS BAS TEC TECNOLOGICO-SUBSTITUTO;D;101;ESCOLA DE MUSICA - UAEM
ERIKA GALVAO DE LIMA;4.799,76;TECNICO DE LABORATORIO AREA;D;;DEPTO DE MICROBIOLOGIA E PARASITOLOGIA
ERINALDO SILVA DE SOUSA;4.843,02;TIPOGRAFO;C;;EDITORA UNIVERSITARIA
ERIKSON GIRLEY ANDRADE DE LUCENA;5.114,48;AUXILIAR DE ENFERMAGEM;C;;COMPLEXO DE ESPORTES E EVENTOS
ERICO LUCAS DE OLIVEIRA;3.259,10;ASSISTENTE EM ADMINISTRACAO;D;;MATERNIDADE ESCOLA JANUARIO CICCO
ERIKA DOS REIS GUSMAO ANDRADE;21.407,18;PROFESSOR DO MAGISTERIO SUPERIOR;7;703;PRO-REITORIA DE GRADUACAO
ERIKA JANAINA SANTIAGO MOREIRA FREIRE;2.968,78;PROF ENS BAS TEC TECNOLOGICO-SUBSTITUTO;D;101;COLEGIO DE APLICACAO - NEI
ERIVAN FERREIRA DA SILVA;7.648,76;VIGILANTE;D;;DIVISAO DE SEGURANCA PATRIMONIAL
EUGENIO PACCELLI AGUIAR FREIRE;9.570,41;PROFESSOR ENS BASICO TECN TECNOLOGICO;D;102;INSTITUTO METROPOLE DIGITAL
ERMETON DUARTE DO NASCIMENTO;11.634,35;PROFESSOR DO MAGISTERIO SUPERIOR;6;601;DEPTO DE MICROBIOLOGIA E PARASITOLOGIA
ERYVALDO SOCRATES TABOSA DO EGITO;20.884,91;PROFESSOR DO MAGISTERIO SUPERIOR;8;801;DEPARTAMENTO DE MEDICINA CLINICA
ESDRAS CALEB OLIVEIRA SILVA;3.719,37;TEC DE TECNOLOGIA DA INFORMACAO;D;;SECRETARIA DE EDUCAÇAO A DISTANCIA
ERMELINDA MARIA MOTA OLIVEIRA;12.607,81;PROFESSOR DO MAGISTERIO SUPERIOR;6;603;ESCOLA AGRICOLA DE JUNDIAI - UAECA
ESMERALDA DE SOUZA DE OLIVEIRA;4.477,79;COPEIRO;B;;CRN-2 ADMINISTRACAO DO SANTO ANTONIO
EUGENIA ENEDINA DE ARAUJO;8.501,78;ASSISTENTE EM ADMINISTRACAO;D;;DIRETORIA DE ADM E CONTROLE ACADEMICO
EUNADIA SILVA CAVALCANTE;11.085,51;PROFESSOR DO MAGISTERIO SUPERIOR;6;601;DEPARTAMENTO DE ARQUITETURA
ERMINIO JOSE ARAUJO DE CARVALHO;3.408,89;PROFESSOR DO MAGISTERIO SUPERIOR;6;604;DEPARTAMENTO DE CIENCIAS CONTABEIS
EURIDES ARAUJO BEZERRA DE MACEDO;3.199,66;PROFESSOR DO MAGISTERIO SUPERIOR;6;601;DEPARTAMENTO DE ENFERMAGEM
EURICO JOSE MONTENEGRO DUTRA;6.092,70;ASSISTENTE EM ADMINISTRACAO;D;;ADMINISTRACAO DO CCS
ESON QUEIROZ GUERRA;4.663,65;ASSISTENTE EM ADMINISTRACAO;D;;COLEGIO DE APLICACAO - NEI
ERIVAN PEREIRA DO NASCIMENTO;4.453,60;AUX EM ADMINISTRACAO;C;;DIRETORIA DE ATENCAO A SAUDE DO SERVIDOR
ESMERALUCIA MIRIAM PEIXOTO;18.883,97;FARMACEUTICO BIOQUIMICO;E;;HOSPITAL UNIVERSITARIO ONOFRE LOPES
EUGENIO MARIANO FONSECA DE MEDEIROS;13.355,25;PROFESSOR DO MAGISTERIO SUPERIOR;6;604;DEPARTAMENTO DE ARQUITETURA
EROTILDES MARIA DA SILVA;6.837,25;SECRETARIO EXECUTIVO;E;;DEPARTAMENTO DE FISIOLOGIA
EUGENIO LIMA DE SOUZA;18.796,96;PROFESSOR ENS BASICO TECN TECNOLOGICO;D;404;ESCOLA DE MUSICA - UAEM
EUDENILSON LINS DE ALBUQUERQUE;44.104,26;PROFESSOR DO MAGISTERIO SUPERIOR;8;801;DEPTO DE BIOFISICA E FARMACOLOGIA
ESTHEPHANIA OLIVEIRA MAIA BATALHA;5.129,80;PROFESSOR ENS BASICO TECN TECNOLOGICO;D;101;COLEGIO DE APLICACAO - NEI
EULER MACIEL DANTAS;7.311,49;PROFESSOR DO MAGISTERIO SUPERIOR;6;604;DEPARTAMENTO DE ODONTOLOGIA
EUNICE FERNANDES DA SILVA;13.838,11;ENFERMEIRO-AREA;E;;HOSPITAL UNIVERSITARIO ONOFRE LOPES
ESTELA MARIA ARAUJO DE CARVALHO;21.045,36;PROFESSOR DO MAGISTERIO SUPERIOR;6;604;DIRETORIA DE ADMINISTRACAO DE PESSOAL
EUNICE CAMARA DE OLIVEIRA;7.380,95;BIBLIOTECARIO-DOCUMENTALISTA;E;;BIBLIOTECA CENTRAL ZILA MAMEDE
EUGENIA VIVIANE DE ARAUJO REGO;3.703,52;ASSISTENTE EM ADMINISTRACAO;D;;DIRETORIA DE ADM E CONTROLE ACADEMICO
EUGENIA MARIA DANTAS;17.125,72;PROFESSOR DO MAGISTERIO SUPERIOR;7;703;DEPARTAMENTO DE GEOGRAFIA
EULALIA MARIA CHAVES MAIA;20.587,87;PROFESSOR DO MAGISTERIO SUPERIOR;8;801;DEPARTAMENTO DE PSICOLOGIA
EUDIONE MEDEIROS DE SOUZA MORAIS;6.926,38;ASSISTENTE EM ADMINISTRACAO;D;;DEPARTAMENTO DE FISIOTERAPIA
ESEQUIAS BEZERRA;7.259,28;VIGILANTE;D;;DIVISAO DE SEGURANCA PATRIMONIAL
ERNANDE REGIS DA SILVA;7.375,27;VIGILANTE;D;;DIVISAO DE SEGURANCA PATRIMONIAL
ERONILSON VIEIRA DA SILVA;16.103,21;PROFESSOR ENS BASICO TECN TECNOLOGICO;D;402;ESCOLA AGRICOLA DE JUNDIAI - UAECA
EVERARDO ARAUJO RAMOS;15.413,91;PROFESSOR DO MAGISTERIO SUPERIOR;7;701;MUSEU CAMARA CASCUDO
EWERTON WILLIAM GOMES BRITO;11.085,51;PROFESSOR DO MAGISTERIO SUPERIOR;6;601;DEPARTAMENTO DE SAUDE COLETIVA
EVANE LOPES TAVARES;16.389,73;ECONOMISTA;E;;PRO-REITORIA DE PLANEJ E COORD GERAL
EZEQUIEL ADNEY LIMA DA PAIXAO;5.129,80;PROFESSOR DO MAGISTERIO SUPERIOR;4;401;DEPARTAMENTO DE LETRAS
EUZEBIA MARIA DE PONTES TARGINO MUNIZ;8.630,04;BIBLIOTECARIO-DOCUMENTALISTA;E;;BIBLIOTECA CENTRAL ZILA MAMEDE
EVILAZIO XAVIER CRUZ JUNIOR;8.043,30;ASSISTENTE EM ADMINISTRACAO;D;;DIRETORIA DE ADMINISTRACAO DE PESSOAL
EVE MARIA FREIRE DE AQUINO;20.513,35;PROFESSOR DO MAGISTERIO SUPERIOR;8;801;DEPARTAMENTO DE ENGENHARIA MECANICA
EVANDRO CARLOS CAMPOS;5.588,49;AUXILIAR DE ENFERMAGEM;C;;HOSPITAL UNIVERSITARIO ONOFRE LOPES
EVERALDO ALVES DE OLIVEIRA;3.742,16;APONTADOR;B;;DIVISAO DE TRANSPORTE E OFICINAS
EVALDO CABRAL DA SILVA;20.039,58;ENGENHEIRO-AREA;E;;SUPERINTENDENCIA DE INFRA-ESTRUTURA
EWERTON MARINHO DA COSTA;5.426,30;PROFESSOR MAGISTERIO SUPERIOR-SUBSTITUTO;4;601;ESCOLA AGRICOLA DE JUNDIAI - UAECA
EVELINE PIPOLO MILAN;18.323,62;PROFESSOR DO MAGISTERIO SUPERIOR;7;703;DEPARTAMENTO DE INFECTOLOGIA
EUZEBIO GUIMARAES BARBOSA;13.160,69;PROFESSOR DO MAGISTERIO SUPERIOR;6;603;DEPARTAMENTO DE FARMACIA
EVERTON PIRES BATISTA;;;;;
EVANS PAIVA DA COSTA FERREIRA;9.570,41;PROFESSOR DO MAGISTERIO SUPERIOR;4;501;DEPARTAMENTO DE ENGENHARIA MECANICA
EVA SILVIA DE AQUINO MAGALHAES;;;;;
EVERTON RANIELLY DE SOUSA CAVALCANTE;9.570,41;PROFESSOR DO MAGISTERIO SUPERIOR;4;601;DEPTO DE INFORMATICA E MAT APLICADA
EWERTON DA SILVA SANTOS;3.703,52;ASSISTENTE EM ADMINISTRACAO;D;;DIRETORIA DE DESENVOLVIMENTO DE PESSOAS
EURISTANIA TRAJANO TEOFILO DE LIMA;;;;;
EVERTON RODRIGUES BARBOSA;8.630,04;BIBLIOTECARIO-DOCUMENTALISTA;E;;ESCOLA DE MUSICA - UAEM
EVERALDO DE MELO CAETANO;4.701,68;MONTADOR-SOLDADOR;B;;DIVISAO DE TRANSPORTE E OFICINAS
EUSAMAR COELHO DE LIMA ROCHA;13.793,76;TECNICO EM ASSUNTOS EDUCACIONAIS;E;;DEPARTAMENTO DE ENGENHARIA QUIMICA
EVERALDO SILVINO DOS SANTOS;17.959,14;PROFESSOR DO MAGISTERIO SUPERIOR;7;704;DEPARTAMENTO DE ENGENHARIA QUIMICA
EVANUCIA GOMES DE OLIVEIRA;7.650,36;RESTAURADOR-AREA;E;;DEPARTAMENTO DE HISTORIA
EXPEDITO SABINO;4.125,97;JARDINEIRO;B;;DEPTO DE ENG DE COMPUTACAO E AUTOMACAO
EVANDRO DOS SANTOS;9.570,41;PROFESSOR DO MAGISTERIO SUPERIOR;4;601;DEPARTAMENTO DE HISTORIA-CERES
EZEQUIAS OLIVEIRA LIRA;16.312,08;PROFESSOR ENS BASICO TECN TECNOLOGICO;D;401;ESCOLA DE MUSICA - UAEM
EXPEDITO SILVA DO NASCIMENTO JUNIOR;16.013,46;PROFESSOR DO MAGISTERIO SUPERIOR;7;701;ADMINISTRACAO DO CB
EWERTON CAMPELO ASSIS DE OLIVEIRA;9.316,32;ENGENHEIRO-AREA;E;;SUPERINTENDENCIA DE INFRA-ESTRUTURA
EVERTON SANTI;9.570,41;PROFESSOR DO MAGISTERIO SUPERIOR;4;602;ESCOLA DE CIENCIAS E TECNOLOGIA - UAECT
FABIANA ANGELICA BRANDAO DE MOURA PAIVA;3.061,65;AUX EM ADMINISTRACAO;C;;PRO-REITORIA DE GESTAO DE PESSOAS
FABIANO ANDRE DE SOUZA MENDONCA;30.264,20;PROFESSOR DO MAGISTERIO SUPERIOR;7;704;DEPARTAMENTO DE DIREITO PUBLICO
FABIO FONSECA FIGUEIREDO;11.709,64;PROFESSOR DO MAGISTERIO SUPERIOR;6;603;DEPARTAMENTO DE POLITICAS PUBLICAS
FABIANA TRISTAO DE SANTANA;11.709,64;PROFESSOR DO MAGISTERIO SUPERIOR;6;603;ESCOLA DE CIENCIAS E TECNOLOGIA - UAECT
FABIO CARVALHO DE SOUZA;;;;;
FABIANA GALVAO MENDES;4.843,36;AUXILIAR DE ENFERMAGEM;C;;HOSPITAL MATERNIDADE ANA BEZERRA
FABIANA LIMA BEZERRA;13.053,78;PROFESSOR DO MAGISTERIO SUPERIOR;6;604;DEPTO DE MICROBIOLOGIA E PARASITOLOGIA
FABIANA RODRIGUES DE ARRUDA CAMARA;12.697,76;PROFESSOR ENS BASICO TECN TECNOLOGICO;D;304;ESCOLA AGRICOLA DE JUNDIAI - UAECA
FABIO COELHO DA SILVA JUNIOR;;;;;
FABIO JOSE PINHEIRO SOUSA;9.570,41;PROFESSOR DO MAGISTERIO SUPERIOR;4;601;ESCOLA DE CIENCIAS E TECNOLOGIA - UAECT
FABIA CRISTINA MIRANDA DE ARAUJO FREIRE;5.157,95;ASSISTENTE EM ADMINISTRACAO;D;;DEPARTAMENTO DE FARMACIA
FABIANA DANTAS SOARES ALVES DA MOTA;8.292,37;PROFESSOR DO MAGISTERIO SUPERIOR;4;401;
FABIAN ARLEY POSADA BALVIN;9.570,41;PROFESSOR DO MAGISTERIO SUPERIOR;4;601;DEPARTAMENTO DE MATEMATICA
FABIA BARBOSA DE ANDRADE;12.269,51;PROFESSOR DO MAGISTERIO SUPERIOR;6;603;FACULDADE DE CIENCIAS DA SAUDE DO TRAIRI
FABIANA ARISTON FILGUEIRA;13.562,87;PROFESSOR DO MAGISTERIO SUPERIOR;5;501;DEPARTAMENTO DE PEDIATRIA
FABIO ANDRE BISPO DE MELO;7.995,09;ADMINISTRADOR;E;;FACULDADE DE CIENCIAS DA SAUDE DO TRAIRI
FABIANO HENRIQUE RODRIGUES SOARES;2.636,21;PROFESSOR MAGISTERIO SUPERIOR-SUBSTITUTO;4;501;DEPARTAMENTO DE SAUDE COLETIVA
FABIANA DA SILVA QUINTANILHA;9.556,51;ENFERMEIRO-AREA;E;;HOSPITAL UNIVERSITARIO ONOFRE LOPES
FABIANA BARBOSA GONCALVES;9.768,47;PROFESSOR DO MAGISTERIO SUPERIOR;4;602;ESCOLA MULTICAMPI DE CIENCIAS MEDICAS
FABIO DALMAZZO SANCHES;11.085,51;PROFESSOR DO MAGISTERIO SUPERIOR;6;601;DEPARTAMENTO DE ENGENHARIA MECANICA
FABIANA CRISTINA MENDONCA DE ARAUJO;12.697,76;PROFESSOR DO MAGISTERIO SUPERIOR;6;604;DEPARTAMENTO DE FONOAUDIOLOGIA
FABIO HENRIQUE DE MORAIS BARRETO;4.919,67;ASSISTENTE EM ADMINISTRACAO;D;;PRO-REITORIA DE GRADUACAO
FABIO HENRIQUE VIEIRA DE CRISTO E SILVA;5.697,61;PROFESSOR DO MAGISTERIO SUPERIOR;4;601;FACULDADE DE CIENCIAS DA SAUDE DO TRAIRI
FABIO DE ALMEIDA VIEIRA;12.697,76;PROFESSOR DO MAGISTERIO SUPERIOR;6;604;ESCOLA AGRICOLA DE JUNDIAI - UAECA
FABIANO JOSE DE OLIVEIRA;4.393,55;MOTORISTA;C;;DIVISAO DE TRANSPORTE E OFICINAS
FABIANE ROCHA BOTARELI;3.005,21;PROFESSOR DO MAGISTERIO SUPERIOR;5;502;DEPARTAMENTO DE ENFERMAGEM
FABIANO DO ESPIRITO SANTO GOMES;13.727,55;PROFESSOR DO MAGISTERIO SUPERIOR;6;604;INSTITUTO DE QUIMICA
FABIANO GUEDES DA SILVA;4.911,06;TECNICO EM CONTABILIDADE;D;;ADMINISTRACAO DO CCSA
FABIANA VILLELA DA MOTTA;13.595,93;PROFESSOR DO MAGISTERIO SUPERIOR;6;604;DEPARTAMENTO DE ENGENHARIA DE MATERIAIS
FABIANO DE CARVALHO ARAUJO;5.145,09;ASSISTENTE EM ADMINISTRACAO;D;;DEPTO DE MICROBIOLOGIA E PARASITOLOGIA
FABIO MAFRA BORGES;13.374,86;PROFESSOR DO MAGISTERIO SUPERIOR;6;601;DEPARTAMENTO DE HISTORIA-CERES
FABIOLA MARIA DA SILVA;4.227,73;AUXILIAR DE ENFERMAGEM;C;;HOSPITAL UNIVERSITARIO ONOFRE LOPES
FABIOLA PESSOA DA CUNHA;3.555,38;ASSISTENTE EM ADMINISTRACAO;D;;PRO-REITORIA DE GRADUACAO
FABRICIO DE SOUZA PEREIRA;6.564,77;MEDICO-AREA;E;;HOSPITAL UNIVERSITARIO ONOFRE LOPES
FABIO SOREN PRESGRAVE;16.758,38;PROFESSOR ENS BASICO TECN TECNOLOGICO;D;402;ESCOLA DE MUSICA - UAEM
FATIMA HARYANNY GOMES RUFINO;9.556,51;ENFERMEIRO-AREA;E;;DIRETORIA DE ATENCAO A SAUDE DO SERVIDOR
FABIOLA BARRETO GONCALVES;11.818,25;REVISOR DE TEXTOS;E;;SECRETARIA DE EDUCAÇAO A DISTANCIA
FABIO MASTROCOLA;6.564,77;MEDICO-AREA;E;;HOSPITAL UNIVERSITARIO ONOFRE LOPES
FATIMA MARIA BARBOSA DE MORAIS;13.490,11;TECNICO EM ASSUNTOS EDUCACIONAIS;E;;DEPARTAMENTO DE GEOLOGIA
FABIO PEREIRA DOS SANTOS;2.236,83;AUX EM ADMINISTRACAO;C;;ADMINISTRACAO DO CCS
FABRICIO PITOMBO LEITE;11.709,64;PROFESSOR DO MAGISTERIO SUPERIOR;6;603;DEPARTAMENTO DE ECONOMIA
FABRICIO GAVA MENEZES;13.263,23;PROFESSOR DO MAGISTERIO SUPERIOR;6;604;INSTITUTO DE QUIMICA
FABIO MARQUES DE OLIVEIRA NETO;4.008,68;PROF ENS BAS TEC TECNOLOGICO-SUBSTITUTO;D;101;ESCOLA AGRICOLA DE JUNDIAI - UAECA
FABIO MENEGHETTI UGULINO DE ARAUJO;16.555,95;PROFESSOR DO MAGISTERIO SUPERIOR;7;703;DEPTO DE ENG DE COMPUTACAO E AUTOMACAO
FABRICIA GONCALVES DE CARVALHO;11.709,64;PROFESSOR DO MAGISTERIO SUPERIOR;6;603;DEPARTAMENTO DE ENGENHARIA DE PRODUCAO
FABRICIA AZEVEDO DA COSTA CAVALCANTI;13.595,93;PROFESSOR DO MAGISTERIO SUPERIOR;6;604;DEPARTAMENTO DE FISIOTERAPIA
FABIO LUIS SOARES DE MACEDO;2.868,34;PROFESSOR DO MAGISTERIO SUPERIOR;4;401;DEPARTAMENTO DE TOCO-GINECOLOGIA
FABIO ROBERTO DAMETTO;12.269,51;PROFESSOR DO MAGISTERIO SUPERIOR;6;603;DEPARTAMENTO DE ODONTOLOGIA
FATIMA REGINA COSTA DE MEDEIROS;6.479,76;TECNICO EM ENFERMAGEM;D;;MATERNIDADE ESCOLA JANUARIO CICCO
FABIO WELLINGTON ATAIDE ALVES;3.199,66;PROFESSOR DO MAGISTERIO SUPERIOR;6;601;DEPT DE DIREITO PROCESSUAL PROPEDEUTICA
FABIOLA MACEDO DIAS;3.564,51;TRADUTOR INTERPRETE DE LINGUAGEM SINAIS;D;;GABINETE DO REITOR
FABRICIO GERMANO ALVES;0,00;PROFESSOR DO MAGISTERIO SUPERIOR;4;601;DEPARTAMENTO DE DIREITO-CERES
FABIOLA SEPHORA BATISTA PEREIRA FERNANDES;4.797,63;TECNICO DE LABORATORIO AREA;D;;DEPTO DE ANALISES CLINIC E TOXICOLOGICAS
FABIO RESENDE DE ARAUJO;10.239,82;PROFESSOR DO MAGISTERIO SUPERIOR;5;501;FACULDADE DE CIENCIAS DA SAUDE DO TRAIRI
FABIO SPEROTTO BEMFICA;11.709,64;PROFESSOR DO MAGISTERIO SUPERIOR;6;603;ESCOLA DE CIENCIAS E TECNOLOGIA - UAECT
FAGNER LEMOS DE SANTANA;11.308,31;PROFESSOR DO MAGISTERIO SUPERIOR;6;603;DEPARTAMENTO DE MATEMATICA
FABRICIO VALE DE AZEVEDO GUERRA;7.994,01;PROFESSOR DO MAGISTERIO SUPERIOR;6;601;DEPT DE COMPUTACAO E TECNOLOGIA-CERES
FABRICIO ROOSEVELT MELO DA SILVA;3.037,78;TECNICO EM ELETRONICA;D;;DEPTO DE ENG DE COMPUTACAO E AUTOMACAO
FAGNER ALEXANDRE NUNES DE FRANCA;9.768,47;PROFESSOR DO MAGISTERIO SUPERIOR;4;602;DEPARTAMENTO DE ENGENHARIA CIVIL
FABIO MAGNO DA SILVA SANTANA;12.132,29;PROFESSOR ENS BASICO TECN TECNOLOGICO;D;304;ESCOLA AGRICOLA DE JUNDIAI - UAECA
FELIPE TAVARES DE ARAUJO;6.354,60;TECNICO EM ASSUNTOS EDUCACIONAIS;E;;DEPARTAMENTO DE POLITICAS PUBLICAS
FELISMINO DA SILVA NETO;9.254,02;ASSISTENTE EM ADMINISTRACAO;D;;SUPERINTENDENCIA DE COMUN UNIVERSITARIA
FELIPE AUGUSTO LEITE FERNANDES;;;;;
FELIPE MEDEIROS RODRIGUES;3.181,04;TEC DE TECNOLOGIA DA INFORMACAO;D;;SUPERINTENDENCIA DE INFORMATICA
FELIPE MACIEL DE OLIVEIRA BRUNET;;;;;
FERNANDA ARIANE SILVA CARRERA;9.570,41;PROFESSOR DO MAGISTERIO SUPERIOR;4;601;DEPARTAMENTO DE COMUNICACAO SOCIAL
FELIPE PALITOT ALVES MANGUEIRA;0,00;;;;
FERNANDA JULYANNA SILVA DOS SANTOS;6.586,66;PROFESSOR ENS BASICO TECN TECNOLOGICO;D;101;ESCOLA DE SAUDE DA UFRN
FERDINAND GILBERT SARAIVA DA SILVA MAIA;;;;;
FELIX FERREIRA BERNARDO;6.586,66;PROFESSOR ENS BASICO TECN TECNOLOGICO;D;101;ESCOLA AGRICOLA DE JUNDIAI - UAECA
FERNANDA DE MEDEIROS FERREIRA AQUINO;7.380,95;BIBLIOTECARIO-DOCUMENTALISTA;E;;BIBLIOTECA CENTRAL ZILA MAMEDE
FERNANDA CRYSTYNNY DOS SANTOS PEREIRA;2.588,42;AUX EM ADMINISTRACAO;C;;DIRETORIA DE DESENVOLVIMENTO DE PESSOAS
FELIPE DE MELO GOMES;3.301,93;ASSISTENTE EM ADMINISTRACAO;D;;ESCOLA DE CIENCIAS E TECNOLOGIA - UAECT
FELIPE PEIXOTO DE BRITO;2.431,33;AUX EM ADMINISTRACAO;C;;DEPARTAMENTO DE EDUCACAO FISICA
FELIPE NALON CASTRO;9.570,41;PROFESSOR DO MAGISTERIO SUPERIOR;4;601;DEPARTAMENTO DE FISIOLOGIA
FELIPE BEZERRA LOPES LISBOA DE OLIVEIRA;5.434,85;ADMINISTRADOR;E;;PRO-REITORIA DE GESTAO DE PESSOAS
FELIPE LEITE GUEDES;6.318,36;MEDICO-AREA;E;;HOSPITAL UNIVERSITARIO ONOFRE LOPES
FELIPE BOHN;12.697,76;PROFESSOR DO MAGISTERIO SUPERIOR;6;604;DEPTO DE FISICA TEORICA E EXPERIMENTAL
FERNANDA DA FONSECA FREITAS;2.991,64;PROFESSOR DO MAGISTERIO SUPERIOR;4;502;FACULDADE DE CIENCIAS DA SAUDE DO TRAIRI
FELIPE MACHADO CAVALCANTI FONSECA;-1000;PROFESSOR MAGISTERIO SUPERIOR-SUBSTITUTO;4;401;DEPARTAMENTO DE TOCO-GINECOLOGIA
FELLIPE COELHO LIMA;9.570,41;PROFESSOR DO MAGISTERIO SUPERIOR;4;601;FACULDADE DE CIENCIAS DA SAUDE DO TRAIRI
FERNANDA CRISTINA BARBOSA PEREIRA QUEIROZ;12.132,29;PROFESSOR DO MAGISTERIO SUPERIOR;6;604;DEPARTAMENTO DE ENGENHARIA DE PRODUCAO
FERNANDA ELVIRA DANTAS MOURA;;;;;
FELIPE DA SILVA MOREIRA;2.968,78;PROFESSOR MAGISTERIO SUPERIOR-SUBSTITUTO;4;401;DEPARTAMENTO DE CIENCIAS CONTABEIS
FERNANDA ANTUNES CARVALHO;9.570,41;PROFESSOR DO MAGISTERIO SUPERIOR;4;601;DEPTO DE BOTANICA E ZOOLOGIA
FELIPE COSTA DE ANDRADE MARINHO;7.086,81;MEDICO-AREA;E;;HOSPITAL UNIVERSITARIO ONOFRE LOPES
FERNANDA DINIZ DE SA;7.994,01;PROFESSOR DO MAGISTERIO SUPERIOR;6;601;FACULDADE DE CIENCIAS DA SAUDE DO TRAIRI
FERNANDA BRITO SABINO;;;;;
FERNANDA FERNANDES GURGEL;9.570,41;PROFESSOR DO MAGISTERIO SUPERIOR;4;601;FACULDADE DE CIENCIAS DA SAUDE DO TRAIRI
FELIPE BRUNO ARAUJO DE MEDEIROS;3.849,67;ASSISTENTE EM ADMINISTRACAO;D;;ESCOLA AGRICOLA DE JUNDIAI - UAECA
FERNANDA MARQUES DE AZEVEDO;3.964,06;TECNICO DE LABORATORIO AREA;D;;DEPTO DE MICROBIOLOGIA E PARASITOLOGIA
FERNANDA MACHADO DE BULHOES;15.652,21;PROFESSOR DO MAGISTERIO SUPERIOR;7;702;DEPARTAMENTO DE FILOSOFIA
FERNANDA MABEL BATISTA DE AQUINO;;;;;
FERNANDO CESAR ALVES DA SILVA;19.171,79;PROFESSOR DO MAGISTERIO SUPERIOR;8;801;DEPARTAMENTO DE GEOLOGIA
FERNANDO ANTONIO ALVES FEITOSA;8.702,72;DESENHISTA TECNICO ESPECIALIZADO;D;;DEPARTAMENTO DE GEOLOGIA
FERNANDO ANTONIO DA SILVA;3.354,76;SERVENTE DE LIMPEZA;A;;HOSPITAL UNIVERSITARIO ONOFRE LOPES
FERNANDO DIEGO RODRIGUES DOS SANTOS;6.586,66;PROFESSOR ENS BASICO TECN TECNOLOGICO;D;101;ESCOLA DE MUSICA - UAEM
FERNANDO GUEDES CURY;11.709,64;PROFESSOR DO MAGISTERIO SUPERIOR;6;603;DEPARTAMENTO DE MATEMATICA
FERNANDA THAIS FERREIRA DE SANTANA;2.236,83;ASSISTENTE DE ALUNO;C;;FACULDADE DE CIENCIAS DA SAUDE DO TRAIRI
FERNANDO ANTONIO SOARES DA CRUZ FILHO;2.446,96;TEC DE TECNOLOGIA DA INFORMACAO;D;;INSTITUTO METROPOLE DIGITAL
FERNANDA PRISCILA SOARES DA COSTA;;;;;
FERNANDA WANDERLEY DE OLIVEIRA;18.376,70;PROFESSOR DO MAGISTERIO SUPERIOR;7;704;DEPARTAMENTO DE BIOQUIMICA
FERNANDA MARUR MAZZE;13.263,23;PROFESSOR DO MAGISTERIO SUPERIOR;6;604;INSTITUTO DE QUIMICA
FERNANDO ANTONIO DE ARAUJO MOURA;16.708,02;MEDICO-AREA;E;;HOSPITAL UNIVERSITARIO ONOFRE LOPES
FERNANDO BOMFIM MARIANA;12.132,29;PROFESSOR DO MAGISTERIO SUPERIOR;7;701;DEPARTAMENTO DE EDUCACAO-CERES
FERNANDO HENRIQUE ANDRADE NOGUEIRA;10.217,56;PROFESSOR DO MAGISTERIO SUPERIOR;4;602;DEPARTAMENTO DE FARMACIA
FERNANDO DE PAIVA FERREIRA JUNIOR;0,00;PROFESSOR MAGISTERIO SUPERIOR-SUBSTITUTO;4;401;DEPARTAMENTO DE ARTES
FERNANDO DE SOUZA SILVA;13.660,86;ENFERMEIRO-AREA;E;;HOSPITAL UNIVERSITARIO ONOFRE LOPES
FERNANDA PESSOA COUTINHO FERNANDES LIMA;7.668,81;ANALISTA DE TEC DA INFORMACAO;E;;SUPERINTENDENCIA DE INFORMATICA
FERNANDO CARDOSO DA SILVA;5.867,05;BIBLIOTECARIO-DOCUMENTALISTA;E;;CENTRO REG DE ENS SUPERIOR DO SERIDO
FERNANDA NERVO RAFFIN;25.499,38;PROFESSOR DO MAGISTERIO SUPERIOR;8;801;PRO-REITORIA ADJUNTA DE POS-GRADUACAO
FERNANDO ANTONNY GUERRA ALVES;7.380,95;BIBLIOTECARIO-DOCUMENTALISTA;E;;BIBLIOTECA CENTRAL ZILA MAMEDE
FERNANDO FREIRE LISBOA;26.020,17;PROFESSOR DO MAGISTERIO SUPERIOR;6;604;DEPARTAMENTO DE CIRURGIA
FERNANDA MAYARA SALES DE AQUINO;0,00;PROFESSOR MAGISTERIO SUPERIOR-SUBSTITUTO;4;501;DEPTO DE PRAT EDUCACIONAIS E CURRICULO
FERNANDA RODRIGUES MITTELBACH;16.979,04;PROFESSOR DO MAGISTERIO SUPERIOR;6;604;DIRETORIA DE ADM E CONTROLE ACADEMICO
FERNANDO JOSE PEREIRA PINTO;12.966,86;ODONTOLOGO - 30 HORAS - DL 1445-76;E;;DEPARTAMENTO DE ODONTOLOGIA
FERNANDO JOSE DE MEDEIROS COSTA;12.709,59;PROFESSOR DO MAGISTERIO SUPERIOR;6;604;DEPARTAMENTO DE ARQUITETURA
FERNANDO GOMES TEIXEIRA;7.711,64;PROFESSOR DO MAGISTERIO SUPERIOR;6;604;DEPARTAMENTO DE SERVICO SOCIAL
FERNANDA PALHANO XAVIER DE FONTES;4.209,12;PROF ENS BAS TEC TECNOLOGICO-SUBSTITUTO;D;101;INSTITUTO METROPOLE DIGITAL
FERNANDO CESAR DE MIRANDA;17.824,78;PROFESSOR DO MAGISTERIO SUPERIOR;7;702;DEPARTAMENTO DE ESTATISTICA
FILIPE CAMARA DE OLIVEIRA;4.001,88;ASSISTENTE EM ADMINISTRACAO;D;;ADMINISTRACAO DO CCS
FLAVIANE DE OLIVEIRA SILVA MAGALHAES FERRAZ;5.501,29;TECNICO EM SANEAMENTO;D;;SUPERINTENDENCIA DE INFRA-ESTRUTURA
FIDEL ERNESTO CASTRO MORALES;12.132,29;PROFESSOR DO MAGISTERIO SUPERIOR;6;604;DEPARTAMENTO DE ESTATISTICA
FERNANDO LUIS AMARAL FERREIRA DE SOUZA;4.947,67;ASSISTENTE EM ADMINISTRACAO;D;;SUPERINTENDENCIA DE COMUN UNIVERSITARIA
FLAVIO BOLEIZ JUNIOR;11.308,31;PROFESSOR DO MAGISTERIO SUPERIOR;6;602;DEPTO DE FUND E POLITICAS DA EDUCACAO
FLAUBERT HIGOR CAMARA DE SOUZA;3.999,80;TECNICO DE LABORATORIO AREA;D;;FACULDADE DE CIENCIAS DA SAUDE DO TRAIRI
FERNANDO MARQUES FIGUEIRA FILHO;12.206,48;PROFESSOR DO MAGISTERIO SUPERIOR;6;602;DEPTO DE INFORMATICA E MAT APLICADA
FERNANDO LUIZ DE ARAUJO SILVA FILHO;10.612,41;MEDICO-AREA;E;;HOSPITAL UNIVERSITARIO ONOFRE LOPES
FLAVIO ANTONIO DA SILVA;7.015,68;VIGILANTE;D;;DIVISAO DE SEGURANCA PATRIMONIAL
FLAVIA DE SA PEDREIRA;16.550,57;PROFESSOR DO MAGISTERIO SUPERIOR;7;702;DEPARTAMENTO DE HISTORIA
FLAVIO BEZERRA COSTA;12.269,51;PROFESSOR DO MAGISTERIO SUPERIOR;6;603;ESCOLA DE CIENCIAS E TECNOLOGIA - UAECT
FERNANDO JOSE VOLPI EUSEBIO DE OLIVEIRA;12.269,51;PROFESSOR DO MAGISTERIO SUPERIOR;6;603;INSTITUTO DE QUIMICA
FERNANDO MANUEL ROCHA DA CRUZ;11.308,31;PROFESSOR DO MAGISTERIO SUPERIOR;6;603;DEPARTAMENTO DE POLITICAS PUBLICAS
FERNANDO MONTANARO PAIVA DE ALMEIDA;2.943,90;AUX EM ADMINISTRACAO;C;;ADMINISTRACAO DO CB
FLAVIERY MADSON DOS SANTOS LIMA;2.943,89;ASSISTENTE DE LABORATORIO;C;;DEPARTAMENTO DE FARMACIA
FILIPE MARTEL DE MAGALHAES BORGES;13.263,23;PROFESSOR DO MAGISTERIO SUPERIOR;7;701;ESCOLA DE CIENCIAS E TECNOLOGIA - UAECT
FLAVIA FERREIRA LEMOS;;;;;
FLAVIA CHRISTIANE DE AZEVEDO MACHADO;10.770,41;PROFESSOR DO MAGISTERIO SUPERIOR;4;601;DEPARTAMENTO DE SAUDE COLETIVA
FLAVIA DA COSTA FERNANDES MESQUITA;;;;;
FLAUBER CARLOS COSTA;3.178,00;TECNICO EM ELETROTECNICA;D;;DEPARTAMENTO DE GEOFISICA
FLAVIANA DE SOUZA CARDOSO;;;;;
FILIPE DE ANDRADE FREIRE;;;;;
FLAVIANE ALCANTARA DA CUNHA;0,00;;;;
FLAVIA ROLDAN VIANA;6.586,66;PROFESSOR DO MAGISTERIO SUPERIOR;4;501;DEPTO DE PRAT EDUCACIONAIS E CURRICULO
FERNANDO VAGNER LOBO LADD;10.459,71;PROFESSOR DO MAGISTERIO SUPERIOR;4;601;DEPARTAMENTO DE MORFOLOGIA
